Index,title,date,Label_News,,
488,"Male student detained as suspect in shooting at Indiana middle school, Noblesville police chief says. Adult teacher, juvenile shooter transported to hospital",5/26/2018,2,,
489,Shootings mark a violent Memorial Day weekend in DC,5/27/2018,2,,
490,"An American Airlines Passenger Was Refused Beer - So He Screamed, Fought And Spit Blood, FBI Says",5/27/2018,2,,
491,"Ball and chain: Lawmakers are trying to curb contracts that make it harder to change jobs -- Non-compete agreements are startlingly common in America, even for workers on low pay",5/27/2018,2,,
492,"Teacher corrects White House letter, sends it back to Trump",5/27/2018,2,,
493,Telemarketing: America is losing the war against robocalls -- Install a blocking app on your phone—not much else can be done,5/28/2018,2,,
494,The mid-terms: We think the Democrats are favoured to take the House -- But the contest is finely balanced,5/28/2018,2,,
495,President George H.W. Bush hospitalized after experiencing low blood pressure Sunday,5/28/2018,2,,
496,California video shows sharks being finned alive and beaten with bats,5/28/2018,2,,
497,Rudy Giuliani booed by Yankee fans on his birthday,5/29/2018,0,,
498,"Ex-Green Beret, NFLer weighs in on anthem rule",5/29/2018,0,,
499,"U.S. economy grew slightly slower 2.2% in first quarter, revised GDP figures show",5/30/2018,1,,
500,Missouri Governor Eric Greitens resigns amid sex scandal,5/30/2018,1,,
501,Harvard study: Black defendants get longer sentences from GOP-appointed judges,5/30/2018,1,,
502,ABC cancels 'Roseanne' after star's racist Twitter rant,5/30/2018,1,,
503,"Hitting pay dirt: American firms reveal the gulf between bosses’ and workers’ pay -- Some states either already have, or are considering imposing, higher taxes on companies with especially big gaps",5/31/2018,0,,
504,Dick's soaring sales prove it can succeed without assault rifles,5/31/2018,0,,
505,Grand jury indicts Harvey Weinstein in rape case,5/31/2018,0,,
506,Ambien maker responds to Roseanne: Racism is ‘not a known side effect’,5/31/2018,0,,
507,Thieves in Inglewood steal $18K in chemo medicine from man battling cancer,6/1/2018,1,,
508,"EPA paid $1,560 for 12 fountain pens",6/2/2018,2,,
509,Justices side with Colorado baker on same-sex wedding cake,6/4/2018,1,,
510,America may soon face its biggest labor strike in decades,6/6/2018,1,,
511,The home of Parkland survivor David Hogg was swatted this morning,6/6/2018,1,,
512,Billions in U.S. solar projects shelved after Trump panel tariff,6/7/2018,1,,
513,CNN's Anthony Bourdain dead at 61,6/8/2018,1,,
514,Navy intelligence compromised by Chinese hackers in massive data breach: Report,6/9/2018,2,,
515,"Trump: Yes, I'll probably back Elizabeth Warren's bill to force the feds to follow state marijuana laws",6/10/2018,2,,
516,Florida revoked 291 concealed weapons permits after an employee stopped reviewing background checks,6/12/2018,0,,
517,Dancing FBI agent who dropped gun during backflip charged in shooting,6/13/2018,0,,
518,"Teens are having less sex and doing drugs less often, but they're sad",6/15/2018,0,,
519,"New York's attorney general is suing the Trump Foundation, as well as Donald Trump and his children, alleging ""extensive and persistent"" lawbreaking.",6/15/2018,0,,
520,NFL Players Association May Challenge New Anthem Policy In Court,6/16/2018,2,,
521,Trump signs order to end migrant separation,6/21/2018,0,,
522,Border patrol agents are stopping people on highways in New England to check their citizenship,6/24/2018,2,,
523,Woman 'humiliated' by Walgreens over drugs to end pregnancy,6/24/2018,2,,
524,AT&T Employees Reportedly Encouraged to Use Unethical Sales Tactics to Drive Up DirecTV Now Subscriptions,6/25/2018,0,,
525,U.S. approves first marijuana plant-derived drug for epilepsy,6/26/2018,1,,
526,HBO Website Is Down in China After John Oliver Skewers Xi,6/26/2018,1,,
527,Justice Kennedy retiring; Trump gets 2nd Supreme Court pick,6/28/2018,1,,
528,"Iowa Supreme Court rejects 72-hour abortion waiting period requirement, says women have right to abortion",6/30/2018,2,,
529,"Idaho: 9 people, including refugees, targeted in stabbings on State Street in Boise, police say",7/1/2018,2,,
530,Former Donald Trump personal attorney Michael Cohen scrubbed the president's name from his Twitter account,7/5/2018,1,,
531,US malls haven't been this empty since 2012,7/6/2018,1,,
532,Trump unexpectedly reveals Scott Pruitt has resigned,7/6/2018,1,,
533,National debt at highest level since after WWII,7/9/2018,1,,
534,"91-year-old man beaten with brick, told 'go back to your own country'",7/10/2018,1,,
535,Northern California jail ends federal immigration contract,7/11/2018,0,,
536,Trump pardons ranchers whose arrests led to armed occupation of wildlife refuge,7/11/2018,1,,
537,Charges against Stormy Daniels are dismissed after Ohio strip club arrest,7/13/2018,1,,
538,"ICE agents arrest 18 human smugglers, 117 illegal immigrants in Texas, New Mexico",7/14/2018,2,,
539,Black farmers file lawsuit alleging company sold 'inferior' seeds on purpose,7/16/2018,1,,
540,Trump praises Putin's 'incredible' offer for special counsel investigators to 'come and work' with Russia on probe,7/17/2018,1,,
541,States sue U.S. to void state and local tax deduction cap,7/18/2018,1,,
542,Measure to break California into 3 states removed from November ballot after court ruling,7/19/2018,0,,
543,Secret Service agent traveling with Trump dies in Scotland,7/19/2018,0,,
544,"Steve Tisch rips President Trump, says Giants won’t punish anthem protesters",7/21/2018,2,,
545,Father of Parkland survivors shot dead,7/21/2018,2,,
546,U.S. home sales fall as prices hit record high,7/24/2018,1,,
547,U.S. border guards target Canadian cannabis executives. At least a dozen executives in the past three months have been banned for life from entering America,7/26/2018,1,,
548,U.S. Senate quietly votes to cut tariffs on hundreds of Chinese goods,7/27/2018,1,,
549,Facebook suspends US conspiracy theorist Alex Jones | Technology,7/28/2018,2,,
550,New York Times urges Trump to end 'enemy' rhetoric,7/30/2018,0,,
551,Supreme Court rejects Trump bid to halt climate change case,7/31/2018,1,,
552,Ted Cruz 2018 election: new polls show challenger Beto O’Rourke has a real shot,8/2/2018,1,,
553,Sarah Jeong's racist tweets spotlighted after New York Times hiring: 'White men are bulls--'. Writer: 'It's sick how much joy I get from being cruel to old white men',8/3/2018,3,,
554,395 People in 15 States Infected in McDonald’s Salad Outbreak,8/4/2018,2,,
555,'It's going to be hard': Sears pension payments cut by 30% this week | CBC News,8/5/2018,2,,
556,"No, U.S. Steel is not opening six new mills as Donald Trump said",8/6/2018,1,,
557,West Hollywood City Council passes resolution to remove Donald Trump Walk of Fame star: Mayor,8/7/2018,1,,
558,"Facebook, Apple, YouTube and Spotify take down Alex Jones content",8/7/2018,1,,
559,"The private prison industry, explained -- The federal government was phasing out private prisons until the Trump administration took office. Why the reversal?",8/8/2018,0,,
560,Sex scandal claims megachurch leadership,8/9/2018,0,,
561,There Will Now Likely Be Two Democratic Socialists of America Members in Congress,8/9/2018,0,,
562,Ark. officer fired for telling black men they 'don't belong' in city,8/12/2018,2,,
563,Trump signs defense bill suspending delivery of F-35 warplanes to Turkey,8/14/2018,1,,
564,Reddit sleuth identifies car part leading to hit-and-run arrest,8/15/2018,0,,
565,Google tracks users who turn off location history,8/15/2018,0,,
566,87-year-old woman tasered by US police while cutting dandelions in Georgia,8/17/2018,1,,
567,Teen who survived fall from 60-foot bridge speaks out: I want pusher in jail,8/17/2018,1,,
568,NYU Makes Tuition Free for All Medical Students School has raised more than $450 million of its estimated $600 million needed to cover tuition in perpetuity,8/17/2018,1,,
569,Satanic Temple Unveils Baphomet Statue at Arkansas Capitol,8/18/2018,2,,
570,ICE says man taken while rushing pregnant wife to hospital is wanted for murder in Mexico,8/20/2018,1,,
571,Twenty-two states ask U.S. appeals court to reinstate 'net neutrality' rules,8/21/2018,1,,
572,"Hurricane Lane Strengthens to Category 5, Hawaii Braces for ‘Life-Threatening’ Winds",8/22/2018,0,,
573,"Immigrant charged with murder of Iowa college student MONTEZUMA, Iowa (AP) — A man from Mexico living in the U.S. illegally has confessed to kidnapping college student Mollie Tibbetts while she was running in her small Iowa hometown, killing her and dumping her body in a rural field",8/22/2018,0,,
574,Verizon Throttled California Firefighters’ Internet Speeds Amid Blaze,8/23/2018,0,,
575,Longtime Trump Organization CFO Weisselberg granted immunity in Cohen probe,8/24/2018,1,,
576,Trump meets with promoter of 'QAnon' conspiracy theory in Oval Office,8/25/2018,2,,
577,"'Mass shooting' at Madden video game tournament in Jacksonville, Florida",8/27/2018,1,,
578,Trump accuses Google of hiding 'fair media' coverage of him,8/28/2018,0,,
579,White House urged to lower flag for McCain,8/28/2018,0,,
580,Jacksonville shooter legally armed himself in state with one of USA's toughest gun laws,8/29/2018,1,,
581,California looks to adopt Obama-style net neutrality rules,8/31/2018,0,,
582,"John McCain's 106-year-old mother expected to attend memorial services in DC, Maryland",8/31/2018,0,,
583,You Did It: California Net Neutrality Passes State Assembly,9/1/2018,2,,
584,Kavanaugh Hearing Instantly Melts Down: ‘This is a Charade and a Mockery’,9/4/2018,1,,
585,Colin Kaepernick Named Face of Nike's 30th Anniversary of 'Just Do It' Campaign,9/4/2018,1,,
586,US police captain's son jailed for terror plot,9/6/2018,1,,
587,Lawmakers seek answers for why Native American women vanish,9/6/2018,1,,
588,LeBron James: 'I Stand with Nike' After Colin Kaepernick 'Just Do It' Ad,9/6/2018,1,,
589,"Colin Kaepernick's Nike commercial is a big hit with consumers, according to industry group",9/7/2018,0,,
590,A teen who spent his free time speaking out against gun violence was shot and killed in Chicago,9/8/2018,2,,
591,"Ford Recalls 2,000,000 Pickup Trucks; Seat Belts Can Cause Fires",9/9/2018,2,,
592,Louisiana Mayor Bans All Nike Purchases For City Recreation Programs,9/10/2018,0,,
593,President Trump caught cracking joke about terrorists while discussing Niger ambush where four U.S. soldiers died,9/11/2018,1,,
594,Pentagon Was Not Notified Of Proposal To Change Military Lending Act : NPR,9/12/2018,1,,
595,"BREAKING: 6 people dead, including suspect, following multiple shootings in Southeast Bakersfield",9/13/2018,1,,
596,Court rules man in ICE custody for nearly two years is US citizen: report,9/13/2018,1,,
597,Brett Kavanaugh 'sexual assault victim' speaks,9/17/2018,0,,
598,"New research shows that, post net neutrality, internet providers are slowing down your streaming",9/18/2018,1,,
599,Trump's Space Force could cost nearly $13B over 5 years,9/18/2018,1,,
600,McCaskill says she's voting 'no' on Brett Kavanaugh for Supreme Court,9/20/2018,1,,
601,Duke Energy confirms new coal ash spill in North Carolina,9/21/2018,1,,
602,Man who impregnated 10-year-old girl sentenced to 160 years in prison,9/22/2018,2,,
603,Dallas officer fired for killing innocent man in his own apartment,9/25/2018,0,,
604,Ford CEO says metals tariffs cost company $1 billion,9/27/2018,1,,
605,Nashville police officer charged with criminal homicide after shooting black man in the back,9/28/2018,2,,
606,Warren plans to take a 'hard look' at running for president,9/30/2018,2,,
607,California's tough net neutrality bill prompts US lawsuit,10/1/2018,1,,
608,L.A. airport allowing passengers to carry marijuana,10/2/2018,1,,
609,Trump Engaged in Suspect Tax Schemes as He Reaped Riches From His Father,10/3/2018,0,,
610,Palin’s son to spend year in custody after third assault allegation,10/4/2018,0,,
611,"Undercover cops break Facebook rules to track protesters, ensnare criminals",10/5/2018,0,,
612,Heitkamp To Vote No On Kavanaugh,10/5/2018,0,,
613,"Popular sparkling water company LaCroix is facing a lawsuit that alleges its products are mislabeled as ""all-natural,"" and the allegations are weighing on the shares of its parent company National Beverage",10/6/2018,2,,
614,"Officer who fatally shot Tamir Rice hired by Bellaire, Ohio, police department",10/7/2018,2,,
615,Colin Powell Says Donald Trump has Turned America from 'We the People' to 'Me the President',10/8/2018,1,,
616,"Bride goes ahead with wedding photos, despite tragic loss of firefighter fiance",10/10/2018,0,,
617,Utah just experienced its driest year since scientists have kept records,10/11/2018,0,,
618,Chief Justice Roberts Requests Tenth Circuit To Investigate Kavanaugh Ethics Questions,10/12/2018,0,,
619,Video Released of White Man Shooting at 14-Year-Old Black Teen Who Asked for Directions,10/12/2018,0,,
620,"Rates of unvaccinated children on the rise, says CDC",10/13/2018,2,,
621,U.S. retailer Sears files for Chapter 11 bankruptcy,10/15/2018,0,,
622,"Over 1,000 Remain Missing A Week After Hurricane Michael",10/17/2018,1,,
623,Remains of 63 Fetuses and Infants Found at Second Detroit Funeral Home,10/21/2018,2,,
624,Mikhail Gorbachev warns Donald Trump against pulling out of missile treaty with Russia,10/22/2018,0,,
625,"Secret Service intercepts 2 'suspicious packages' addressed to Obama, Clinton",10/24/2018,0,,
626,New Jersey mom helps thwart school shooting plot in Kentucky,10/24/2018,0,,
627,Dow tumbles more than 600 points and sheds year-to-date gains amid late-session drop,10/25/2018,1,,
628,Google sacks dozens over sexual harassment,10/26/2018,0,,
629,Texas admits: Voting machines are changing Texas voters ballots,10/28/2018,2,,
630,Trump’s Saudi Arabia Response Shows His Foreign Policy Is Only About Money,10/29/2018,0,,
631,"Local, national officials decline to appear with Trump in Pittsburgh",10/30/2018,1,,
632,The Cop Said He “Slipped.” The Video Shows Him Forcing An 11-Year-Old Girl To The Ground. He Wasn’t Punished.,10/31/2018,1,,
633,"In Wisconsin, Some Fear Foxconn Factory's Main Product Is Smoke and Mirrors",11/1/2018,1,,
634,"Utah mayor killed in ""insider attack"" in Afghanistan, officials say",11/4/2018,2,,
635,Three US Girl Scouts killed 'by intoxicated driver' in hit-and-run,11/6/2018,1,,
636,Ivanka Trump's Business Wins Approval for 16 New Chinese Trademarks Despite Shutting Down,11/6/2018,1,,
637,Michigan becomes 10th state to legalize recreational use of Marijuana,11/7/2018,1,,
638,"Reports of long lines, broken machines as voters go to polls",11/7/2018,1,,
639,Sessions out at Justice Department,11/8/2018,1,,
640,"Antifa at Tucker Carlson's home: Group breaks door, chants at Fox host",11/9/2018,0,,
641,"Fires across California have forced 157,000 people from their homes; 5 found dead in vehicles",11/10/2018,2,,
642,"CA-48 NEWS: Harley Rouda declares victory, unseating antigay Congressman Dana Rohrabacher",11/11/2018,2,,
643,Veterans haven't received GI Bill benefits for months due to ongoing IT issues at VA,11/12/2018,0,,
644,CNN sues President Trump and top White House aides for barring Jim Acosta,11/13/2018,0,,
645,"Death toll in California wildfire rises to 42, marking worst in state history",11/13/2018,0,,
646,Security guard Jemel Roberson shot dead by police while holding suspect at Chicago bar,11/13/2018,0,,
647,"Marvel's Stan Lee dies, aged 95.",11/13/2018,0,,
648,FBI: Reported hate crimes surged by 17 percent in US last year,11/14/2018,0,,
649,Montana: Federal judge denies motion to dismiss case against publisher of neo-Nazi website,11/15/2018,1,,
650,Coast Guard seizes about $500 million worth of cocaine,11/16/2018,1,,
651,New Jersey couple and homeless man whose feel-good story went viral charged with GoFundMe scam. Their GoFundMe story was fake,11/16/2018,1,,
652,Living with an Unmarried Partner Now Common for Young Adults,11/18/2018,2,,
653,Bankrupt Sears wants to give executives $19 million in bonuses,11/18/2018,2,,
654,Ivanka Trump used a personal email account to send hundreds of emails about government business last year,11/20/2018,0,,
655,Anti-vaccine community behind North Carolina chickenpox outbreak,11/20/2018,0,,
656,"‘You don’t go to jail for lying on TV’: GoFundMe scam suspect allegedly says in bombshell recording. Woman arrested in $400,000 GoFundMe fraud scandal was just trying to help homeless veteran and is 'a bit naive,' lawyer says.",11/20/2018,0,,
657,PSA: CDC warns against eating any type of Romaine lettuce due to health risk,11/21/2018,0,,
658,"Oregon man tried to bribe ICE officer to deport his wife and her child. Antonio Burgos married the woman and brought her and her child to the United States from El Salvador, according to his guilty plea.",11/22/2018,2,,
659,Nearly 30 families to be released from South Texas detention center after a federal judge blocked new rules by President Donald Trump that limited the ability of immigrants to request asylum.,11/22/2018,2,,
660,NFL star Aaron Rodgers pledges $1 million to Camp Fire relief efforts,11/22/2018,2,,
661,190 sea turtles found frozen to death along Cape Cod,11/24/2018,2,,
662,Girl Who Wrote Essay About “Senseless Gun Violence” Killed by Stray Bullet in Milwaukee,11/24/2018,2,,
663,Black man killed by Alabama police during mall shooting was 'likely' not the gunman,11/25/2018,2,,
664,Bernie Sanders: I will probably run in 2020 if I'm the best candidate to beat Trump,11/27/2018,1,,
665,"Stephen Hillenburg, creator of 'SpongeBob SquarePants,' has died",11/28/2018,1,,
666,Veterans Affairs Dept. tells congressional staffers it won't repay underpaid GI Bill benefits recipients,11/29/2018,0,,
667,Mom suing U.S. government for $60 million after toddler dies following 'neglectful' immigration detainment,11/29/2018,0,,
668,U.S. Marshal shot and killed outside Arizona house while trying to serve felony warrant,11/30/2018,1,,
669,Republicans Senators Who Tried to Kill Yemen War Resolution Were Paid by Saudi Lobbyists,11/30/2018,1,,
670,George HW Bush dies at 94,12/1/2018,2,,
671,'SpongeBob SquarePants' Fans Petition NFL for Super Bowl Tribute to Late Creator,12/2/2018,2,,
672,"More than 5,500 women came to Illinois to have an abortion last year amid growing restrictions in the Midwest",12/2/2018,2,,
673,Lobbyists Are Working to Sneak a Dangerous Copyright Bill into Must-Pass Spending Legislation that Could Revive Website Blocking Proposals Like SOPA,12/4/2018,0,,
674,Serial sex abuser Jeffrey Epstein apologizes — but not to his victims,12/5/2018,2,,
675,"Dow sinks nearly 600 points as U.S.-China trade, falling 10-year yield spook investors",12/5/2018,2,,
676,California Democrats plan to extend Medicaid to illegal immigrants,12/6/2018,1,,
677,"Border Patrol agent charged with capital murder in Texas, after telling investigators he killed four sex workers whom he considered worthless and that he thought he was performing a service for his Texas border hometown",12/6/2018,1,,
678,Tucker Carlson says Trump is ‘not capable’ and hasn’t kept his promises,12/7/2018,0,,
679,"Renowned Chinese-American Stanford theoretical physicist Shoucheng Zhang who discovered a new state of matter called topological insulator, explained fractional quantum Hall effect and founded venture capital firm Danhua Capital dies at 55",12/8/2018,2,,
680,Dow falls 600 points after Trump advisers simultaneously contradict each other on trade,12/8/2018,2,,
681,13-year-old student with autism dies after being physically restrained at school,12/9/2018,2,,
682,"Trump 'at center of massive fraud against Americans', top Democrat says",12/10/2018,1,,
683,"Inslee, Governor of Washington State, wants 100 percent clean energy in Washington by 2045",12/11/2018,0,,
684,Biden hits Sanders' home turf as he tests 2020 waters,12/11/2018,0,,
685,Trump said he is not afraid of an impeachment,12/12/2018,1,,
686,Publisher of National Enquirer admits paying hush money to help Trump ahead of 2016 election,12/13/2018,1,,
687,National Debt Under Trump Is Surging at Its Fastest Pace Since 2012,12/13/2018,1,,
688,Trump Inauguration Spending Under Criminal Investigation,12/14/2018,0,,
689,Alleged Russian spy Maria Butina pleads guilty to engaging in conspiracy against US,12/14/2018,0,,
690,"Harvey Weinstein 'bragged of sex with Jennifer Lawrence', lawsuit alleges",12/15/2018,2,,
691,Mobile billboard takes over the D.C. streets exposing “Net Neutrality Traitors” who have failed to support the Congressional Review Act,12/15/2018,2,,
692,"Almost half of U.S. adults have seen a family member jailed, study shows -- About 6.5 million adults have an immediate family member incarcerated.",12/19/2018,0,,
693,An Epidemic Is Killing Thousands Of Coal Miners. Regulators Could Have Stopped It,12/20/2018,0,,
694,Staff at a bank in Ohio called police on a black man trying to cash his paycheck,12/20/2018,0,,
695,"Trump signs farm bill that backs climate change programs, avoids food stamp cuts",12/21/2018,0,,
696,Man wrongfully convicted for doppelganger's crime awarded $1.1 million,12/22/2018,2,,
697,Ruth Bader Ginsburg Eager to Hit the Gym After Cancer Surgery: 'When Can We Go Back to Training?',12/23/2018,2,,
698,"Jennie-O Recalls More Than 164,000 Pounds of Ground Turkey",12/24/2018,0,,
699,"President Donald Trump on Friday signed legislation ramping up quantum computing research and development: ""The National Quantum Initiative Act (H.R. 6227) authorizes $1.2 billion over five years for federal activities aimed at boosting investment in quantum information science""",12/25/2018,2,,
700,Most people who sat out the 2018 elections now say they wish they'd voted,12/29/2018,2,,
701,"People Should Wash Avocados, 17 Percent Have Listeria on Peel: FDA",12/30/2018,2,,
702,U.S. and Israel officially withdraw from UNESCO,1/2/2019,1,,
703,A man attacked a McDonald's employee over a straw and she fought back,1/3/2019,0,,
704,Arkansas law requiring state contractors pledge not to boycott Israel has court challenge,1/5/2019,2,,
705,Trump freezes raises for Pence and Cabinet amid shutdown,1/6/2019,2,,
706,Muslim youth group cleans up national parks amid government shutdown,1/7/2019,1,,
707,"Chicago Seized And Sold Nearly 50,000 Cars Over Tickets Since 2011, Sticking Owners With Debt",1/8/2019,1,,
708,Supreme Court will not intervene in Mueller grand-jury subpoena case,1/9/2019,1,,
709,Oil executive arrested for throwing Chihuahuas off balcony,1/10/2019,1,,
710,"Due to TSA absences, Miami airport will temporarily close one terminal early for 3 days",1/11/2019,1,,
711,Florida pardons 4 black men accused of 1949 rape,1/12/2019,2,,
712,Trump bears most blame for shutdown,1/13/2019,2,,
713,Second U.S. judge blocks Trump administration birth control rules,1/15/2019,1,,
714,Air traffic controller union official says if shutdown continues there won’t be any workers left,1/16/2019,1,,
715,Judge Orders Trump Administration To Remove 2020 Census Citizenship Question,1/16/2019,1,,
716,Ocasio-Cortez rips Trump in first House floor speech: 'It is not normal to shut down the government when we don’t get what we want',1/17/2019,1,,
717,GOP Sen. Lindsey Graham says Trump canceling Pelosi's overseas trip was 'sophomoric' and 'inappropriate',1/18/2019,1,,
718,Feeling the heat: California’s biggest utility is in deep trouble -- PG&E’s role in starting wildfires could mean a break-up or even bankruptcy,1/19/2019,2,,
719,Record number of Native American legislators in Montana are making their presence felt,1/20/2019,2,,
720,Ruth Bader Ginsburg to Make Cameo Appearance in 'Lego Movie 2',1/20/2019,2,,
721,Maga hat boy's mother blames 'black Muslims' for her son harassing Native American man,1/21/2019,2,,
722,Brutal Arctic blast overtakes eastern US with wind chill falling to -30 degrees in some areas,1/22/2019,0,,
723,Trump: No State of the Union during shutdown after being disinvited by Pelosi,1/24/2019,0,,
724,Michael Cohen postpones testimony 'after Donald Trump threatens his family',1/24/2019,0,,
725,A study says 'AI' to hit hardest in U.S. heartland and among less-skilled,1/25/2019,1,,
726,"Senate panel subpoenas Michael Cohen, President Trump's former lawyer",1/25/2019,1,,
727,Government to be opened for 3 weeks in new bill,1/26/2019,2,,
728,"Measles Outbreak Grows in Northwest US, 31 Cases Reported",1/27/2019,2,,
729,Scientists Create Liquid Fuel That Can Store The Sun's Energy For Up to 18 Years,1/28/2019,0,,
730,Washington Governor Declares State of Emergency In All Counties,1/28/2019,0,,
731,"NY Columbia Engineers translate brain signals directly into speech: This breakthrough, harnessing the power of speech synthesizers and artificial intelligence, could lead to new ways for computers to communicate directly with the brain. It lays the groundwork for helping people who cannot speak.",1/30/2019,1,,
732,Catholic Church in Texas Names Nearly 300 Priests Accused of Sex Abuse,2/1/2019,1,,
733,TAKEN: How police departments make millions by seizing property,2/3/2019,2,,
734,"Smoking ban: Hawaii aims to ban cigarettes, tobacco with legislation",2/5/2019,1,,
735,Rough ride: Harley-Davidson brought low by tariffs and demographics -- Sales keep plunging in the home market,2/8/2019,1,,
736,Arizona's 'In God We Trust' license plates fund anti-LGBT group,2/10/2019,2,,
737,"Fox News host Pete Hegseth: ""Germs are not a real thing. I can't see them; therefore, they're not real.""",2/11/2019,0,,
738,The Green New Deal wants America to invest in high-speed rail: The section of the FAQ on transportation calls to “build out high-speed rail at a scale where air travel stops becoming necessary.”,2/11/2019,0,,
