Index,title,date,Label_News,,
739,L.A. to Abandon Plan to Invest Billions in Fossil Fuels: Mayor Garcetti,2/13/2019,1,,
740,"In 2018, Amazon Made $11.2B In Profit Yet Paid $0 In Federal Taxes",2/16/2019,2,,
741,Trump Declares National Emergency to Build Border Wall,2/16/2019,2,,
742,Postal Service starts using all-electric vans in California,2/18/2019,2,,
743,Alabama senator calls for newspaper editor to resign following editorial that called for return of Ku Klux Klan,2/19/2019,1,,
744,"In North Carolina, Investigators Find Ballot ‘Scheme’ in House Race",2/19/2019,1,,
745,"Brothers say Jussie Smollett paid them to participate in alleged attack, source says",2/19/2019,1,,
746,"Texas border agents stop truck carrying frozen strawberries, discover nearly $13M of meth",2/21/2019,0,,
747,"America's food banks are full to bursting with all the meat and produce that normally would be exported to China, but are going unsold because of the trade war.",2/21/2019,0,,
748,"Bill would provide free ID card for homeless: ""A 2006 national survey conducted by the Brennan Center found that as many as 11 percent of Americans, or more than 21 million people, don’t have government-issued photo ID.""",2/25/2019,0,,
749,Senators who received Big Money from Big Pharma will be slated to question company CEOs on Capital Hill today.,2/26/2019,1,,
750,Warren Buffett says the wealthy are 'undertaxed' compared with the rest of the US population,2/26/2019,1,,
751,New Hampshire House Passes Marijuana Legalization Bill,2/28/2019,0,,
752,Resolution Would Claw Back Presidential Power From In Emergency Declarations,3/1/2019,1,,
753,"As questions loom about Jared Kushner's security clearance, House committee says White House not cooperating in probe",3/1/2019,1,,
754,Bill raising minimum age for marriage in Utah from 15 to 16 clears the House,3/2/2019,2,,
755,U.S. to end large-scale military drills with South Korea,3/2/2019,2,,
756,NASA’s Curiosity Rover Is Back To Work After Bizarre Glitch,3/3/2019,2,,
757,Actor Luke Perry dies after stroke at 52,3/5/2019,0,,
758,Congress is finally going to pot: Bills to loosen marijuana laws are gaining traction in both parties,3/6/2019,0,,
759,Trump cheered Kraft’s team to Super Bowl victory with founder of spa where he was busted,3/8/2019,1,,
760,"Cohen Sues Trump Organization, Saying He Was Denied $1.9 Million in Legal Fees After Cooperating With Prosecutors",3/8/2019,1,,
761,Unvaccinated student infects at least 21 people with measles in NYC,3/9/2019,2,,
762,Kansas doctor sentenced to life in prison for selling opioid prescriptions for cash,3/10/2019,2,,
763,School bus driver tells children ‘go f*** yourselves’ then abandons them at gas station,3/10/2019,2,,
764,Man comes forward with ANOTHER tape that appears to show R. Kelly sexually abusing girls,3/11/2019,1,,
765,No tetanus vaccine = nealy a million dollars and weeks of agony for child,3/12/2019,0,,
766,CDC reports 228 measles cases in 12 states,3/13/2019,1,,
767,"6th Circuit rules Ohio’s move to defund Planned Parenthood is constitutional, delivering blow to abortion advocates",3/13/2019,1,,
768,The College Admissions System Is a Scam In Itself,3/14/2019,1,,
769,US court: Sandy Hook victims' families can sue Remington,3/15/2019,1,,
770,Disney rehires James Gunn for Guardians of the Galaxy 3 after firing him over old tweets,3/16/2019,2,,
771,Lori Loughlin and Felicity Huffman sued for $500bn in college cheating scam,3/16/2019,2,,
772,"320-pound woman gets life sentence for sitting on, smothering girl",3/17/2019,2,,
773,Dozens of black partygoers were arrested over less than an ounce of marijuana. Now they’re suing.,3/18/2019,1,,
774,King of surf guitar Dick Dale dead at 81,3/18/2019,1,,
775,"California National Guard to leave border, help stop fires",3/20/2019,0,,
776,U.S. jury rules against Bayer in Roundup cancer case,3/20/2019,0,,
777,"Man stole $122m from Facebook and Google by sending them random bills, which the companies dutifully paid",3/25/2019,1,,
778,New York county declares measles outbreak emergency,3/27/2019,0,,
779,NY County Bans Unvaccinated Kids From Public Over Measles,3/27/2019,0,,
780,Average Americans can't afford a home in 70 percent of the country,3/28/2019,1,,
781,Half of Older Americans Have Nothing in Retirement Savings,3/28/2019,1,,
782,U.S. lawmakers introduce bill to stop NSA's mass data collection,3/29/2019,1,,
783,"Thousands of US bridges are 'structurally deficient,' industry group says",4/2/2019,0,,
784,Apple employee detained by US border agents over his iPhone and laptop speaks out,4/6/2019,2,,
785,Mueller report: Senate Republicans keep blocking a resolution to make the report public,4/6/2019,2,,
786,Motel 6 will pay $12 million after several locations gave their guest lists to ICE,4/8/2019,1,,
787,Secret Service director out less than 24 hours after DHS secretary resigns,4/9/2019,0,,
788,Actress Felicity Huffman has agreed to plead guilty in the college admissions cheating scandal.,4/9/2019,0,,
789,Sen. Grassley: Pharmacy 'middlemen' hearing should lead to a bill to end drug industry 'secrecy',4/10/2019,0,,
790,New York City Council passes ban on pre-employment marijuana testing,4/12/2019,1,,
791,Kentucky Republicans Worried Inviting AOC to Meet with Coal Miners Might Backfire,4/17/2019,0,,
792,Denver may become the first US city to decriminalize psychedelic mushrooms,4/18/2019,1,,
793,"60 doctors, pharmacists charged in largest US opioid prescription bust",4/18/2019,1,,
794,"Broward County, FL Sheriff's Office beating high school students..",4/19/2019,2,,
795,Church Membership in US Has Plummeted in 20 Years,4/19/2019,2,,
796,70% of Wall Street thinks Trump will be reelected in 2020,4/20/2019,2,,
797,KKK leader’s wife admits to killing her husband,4/21/2019,2,,
798,California just made more clean energy than it needed – pv magazine USA,4/23/2019,1,,
799,American millennials have less money than other generations did at their age — but studies show an alarming amount of them have delusional ideas about their wealth,4/24/2019,0,,
800,Student Loans are Destroying Millennials’ Homeownership Ambitions,4/24/2019,0,,
801,Proposed bill would fine $10K per robocall,4/27/2019,2,,
802,An Apple lobbyist just sneakily pushed California to postpone its right-to-repair bill,5/2/2019,0,,
803,"About 13m US children are living below the poverty line, rights group reveals",5/3/2019,1,,
804,"By one vote, Minnesota House moves to ban wolf hunting – Twin Cities",5/3/2019,1,,
805,Joe Biden says he ‘doesn’t have time’ to lay out his healthcare plan,5/5/2019,2,,
806,"As legal marijuana booms, Denver votes on decriminalizing hallucinogenic mushrooms - The Washington Post",5/6/2019,1,,
807,A 'Caravan' of Americans Is Crossing the Canadian Border to Get Affordable Medical Care,5/8/2019,1,,
808,Georgia state abortion law fuels Hollywood boycott call,5/12/2019,2,,
809,Fourth-largest coal producer in the US files for bankruptcy,5/15/2019,1,,
810,"Nation's oldest Medal of Honor recipient, who fell on German grenade, dies at 98",5/15/2019,1,,
811,Tribes across country push for better internet access,5/16/2019,1,,
812,Trump loses lawsuit challenging subpoena for financial records,5/21/2019,1,,
813,Fifty children saved as international paedophile ring busted,5/24/2019,1,,
814,Jessica Chastain and Sophie Turner vow to boycott US states with strict abortion laws,5/29/2019,0,,
815,"Riley Howell, the student who died while tackling a gunman, just received a Purple Heart and Bronze Star",5/29/2019,0,,
816,"Louisiana passes fetal heartbeat abortion ban, Democratic governor says he will sign into law",5/30/2019,1,,
817,Ted Cruz And Alexandria Ocasio-Cortez Make Pact To Address Lobbying,6/1/2019,2,,
818,Dallas police ask for FBI help after third transgender woman murdered,6/4/2019,1,,
819,"Colorado Gov Polis unveils roadmap to 100% carbon free by 2040, signs 11 clean energy bills",6/4/2019,1,,
820,Undercover Group Exposes Fairlife Dairy(Coca-Cola Partner) Animal Cruelty,6/5/2019,1,,
821,"More Than 2,300 Suspected Online Child Sex Offenders Arrested During Operation “Broken Heart”",6/12/2019,0,,
822,AOC’s push to ease limits on psychedelic research advances in House,6/12/2019,0,,
823,"Republicans join Democrats to rebuke Trump's 'emergency' $8B arms sale to Saudis, Emiratis",6/13/2019,1,,
824,Jay-Z Hires Lawyer For Black Family Held At Gunpoint By Phoenix Police Dept.,6/18/2019,1,,
825,Cancer-Causing Ingredient in Weedkiller Found in Cheerios,6/20/2019,1,,
826,Senate Decriminalizes Marijuana Use In New York State,6/22/2019,2,,
827,Johnson & Johnson faces multibillion opioids lawsuit that could upend big pharma,6/23/2019,2,,
828,Human trafficking in America among worst in world: report,6/25/2019,0,,
829,City of El Paso penalizes Trump campaign nearly $100K for unpaid bill,6/26/2019,0,,
830,Charlottesville car rammer James Alex Fields sentenced to life in prison,6/29/2019,2,,
831,"Piles of poop, litter on trails, trampled wildflowers. In the social-media era, Washington’s public lands are being destroyed. What can be done?",6/30/2019,2,,
832,Park Service diverts $2.5 million in fees for Trump’s Fourth of July extravaganza,7/4/2019,2,,
833,25 Dallas police officers are under investigation for allegedly posting racist and violent content on social media,7/6/2019,2,,
834,Billionaire sex offender Jeffrey Epstein arrested for alleged sex trafficking,7/7/2019,2,,
835,Louisiana: Woman found dead in trunk of car was founder of Baton Rouge African American history museum,7/14/2019,2,,
836,Ted Lieu: I have served in the Air Force and in Congress. People still tell me to ‘go back’ to China.,7/17/2019,0,,
837,"In lopsided vote, House kills effort to impeach Trump -- The measure was being pushed by Texas Rep. Al Green, who says the president is unfit for office",7/18/2019,1,,
838,DEA Database Reveals Anti-Cannabis Utah Senate Majority Leader is County’s Largest Opiate Dealer,7/23/2019,1,,
839,Jeffrey Epstein found injured in New York jail cell,7/25/2019,0,,
840,Vehicle plows through crowd of peaceful protesters gathered at anti-violence rally in Wisconsin,8/4/2019,2,,
841,Mother of El Paso shooter called police about son owning assault rifle: Lawyers,8/8/2019,1,,
842,"Jeffrey Epstein, accused sex trafficker, dies by suicide: Officials",8/10/2019,2,,
843,42% of Americans say they can't afford a vacation,8/14/2019,0,,
844,It's raining plastic: microscopic fibers fall from the sky in Rocky Mountains,8/14/2019,0,,
845,WaPo Reports Autopsy of Jeffrey Epstein’s Body Found Multiple Neck Bone Fractures,8/15/2019,1,,
846,Happy 73rd Anniversary President Jimmy and Rosalynn Carter,8/17/2019,2,,
847,"Indiana Cyanide Leak Kills 3,000 Fish and Shut Down Beaches at America's Newest National Park",8/21/2019,1,,
848,Oklahoma judge orders Johnson & Johnson to pay $572M in opioid suit,8/27/2019,0,,
849,Children of US Troops Born Overseas Will No Longer Get Automatic American Citizenship,8/29/2019,1,,
850,"$58,000 reward offered after more than 40 wild burros found shot dead in the Mojave Desert",9/1/2019,2,,
851,14-year-old boy confesses to killing all 5 family members in home: Authorities,9/4/2019,1,,
852,"Marijuana use by US college students up, highest in 35 years",9/6/2019,1,,
853,Supreme Court allows Trump administration to enforce toughest restriction yet on migrant asylum requests,9/12/2019,0,,
854,"Eddie Money, ‘Two Tickets to Paradise’ Singer, Dies at 70",9/13/2019,1,,
855,"Whole Foods to cut healthcare for 1,900 part-time employees in 2020",9/13/2019,1,,
856,Medicare for All Would Cut Poverty by Over 20 Percent,9/13/2019,1,,
857,8 Years of Trump Tax Returns Are Subpoenaed by Manhattan D.A.,9/17/2019,1,,
858,Colt suspends production of AR-15 for civilian market,9/20/2019,0,,
859,Unvaccinated Children Are Now Barred From Going To School In New York — And Their Anti-Vax Parents Are Really Mad,9/21/2019,2,,
860,NY schools beginning to bar unvaccinated students from class,9/23/2019,1,,
861,Democrats launch Trump impeachment inquiry,9/25/2019,1,,
862,Speaker Nancy Pelosi to announce formal impeachment inquiry of President Trump,9/25/2019,1,,
863,House approves marijuana banking bill in historic vote!,9/26/2019,0,,
864,"White students called a 10-year-old black girl the N-word as they beat her up on a bus, court documents say",9/28/2019,2,,
865,Texas deputy who wore Sikh turban and beard on the job killed during traffic stop,9/28/2019,2,,
866,"Attorney General Barr personally asked foreign officials to aid inquiry into CIA, FBI activities in 2016",10/1/2019,0,,
867,"Americans Spent More on Taxes in 2018 Than on Food, Clothing and Health Care Combined",10/2/2019,0,,
868,"Nearly 3 Billion Birds Gone -- A new study finds steep, long-term losses across virtually all groups of birds in the U.S. and Canada",10/5/2019,2,,
869,The Rich Really Do Pay Lower Taxes Than You,10/8/2019,0,,
870,"Ted Cruz, Alexandria Ocasio-Cortez co-sign Congressional request that NBA suspend activities in China",10/10/2019,1,,
871,"Officer seen on bodycam shooting, killing woman in her own home",10/13/2019,2,,
872,Opinion: LeBron James undermines values he's espoused in most disgraceful moment of career,10/15/2019,1,,
873,"Andrew Yang bashes Elizabeth Warren wealth tax, arguing it didn't work in Europe",10/16/2019,1,,
874,Panama Papers law firm founders ‘investigated by the FBI’,10/17/2019,0,,
875,High school security guard fired for telling student not to call him the N-word,10/19/2019,2,,
876,"Youth suicide rates are on the rise in the U.S. | No racial or ethnic group has been spared in this rising rate among young Americans, according to federal data.",10/21/2019,0,,
877,Google accused of spying with new tool that flags large employee meetings,10/24/2019,0,,
878,California plans to end 'lunch shaming' with a new bill that guarantees meals for all students,10/24/2019,0,,
879,Family of British teen killed in collision with wife of US diplomat to sue Trump administration,10/30/2019,1,,
880,"$16.8 Million In Campaign Funds Went To Trump Businesses, Latest Records Reveal When the president holds a fundraiser at one of his properties, he gets donations while his business collects money for rent and catering. By Mary Papenfuss, HuffPost US Oct. 29, 2019",10/31/2019,0,,
881,"Keystone oil pipeline leaks 383,000 gallons in North Dakota",11/1/2019,1,,
882,"'Our task was to set Americans against their own government': New details emerge about Russia's trolling operation Sonam Sheth Oct 17, 2017, 5:26 PM",11/2/2019,2,,
883,"A Michigan Man Underpaid His Property Taxes By $8.41. The County Seized His Property, Sold It—and Kept the Profits.",11/6/2019,0,,
884,ABC News Anchor Caught on Hot Mic Saying Network Spiked Jeffrey Epstein Story,11/6/2019,0,,
885,"Georgia State Lawmaker Proposes Making Gender Transition Surgery for Minors a Felony BY MATT MARGOLIS OCTOBER 31, 2019",11/7/2019,1,,
886,Stop Trying to Raise Successful Kids And start raising kind ones.,11/9/2019,2,,
887,Principal who banned gay books charged with child pornography,11/14/2019,1,,
888,Marijuana reform bill MORE Act of 2019 passes in historic vote,11/21/2019,0,,
889,"Indiana church wipes out $7.8 million in medical debt for nearly 6,000 families",11/24/2019,2,,
890,"Phoenix to stop using red-light, speed-enforcement cameras",11/25/2019,1,,
891,Animal cruelty is now a federal felony in the U.S.,11/27/2019,1,,
892,"In a huge blow to Trump, the DOJ watchdog found no evidence to support the claim that the FBI spied on his 2016 campaign",11/28/2019,2,,
893,"spill from the Keystone Pipeline nearly a month ago was roughly 10 times larger than first reported, officials now say",11/30/2019,2,,
894,"Televangelist Acton Bowen Pleads Guilty To Sexually Abusing Multiple Children DECEMBER 2, 2019 BY MICHAEL STONE",12/3/2019,1,,
895,"Body camera video shows California Police Officer shoot, kill 15-year-old boy without any verbal warning",12/6/2019,1,,
896,"Far-Right Terrorism Has Increased 320 Percent in Just 4 Years, Extremism Watchdog Warns",12/8/2019,2,,
897,Female TV reporter seeks criminal charges against man who slapped her backside on camera,12/12/2019,1,,
898,"How robocalls became America's most prevalent crime -- Today, half of all phone calls are automated scams.",12/13/2019,1,,
899,‘Nobody is above the law’: Americans take to streets in support of Trump impeachment,12/19/2019,1,,
900,"Sex-trafficking victim faces life in jail for killing her rapist Brad Hunter Dec. 18, 2019",12/20/2019,0,,
901,US raises tobacco and e-cigarette purchase age from 18 to 21,12/21/2019,2,,
902,Poll: Majority approves of Trump's impeachment,12/23/2019,1,,
903,Senate confirms avalanche of Trump-backed judges despite impeachment,12/30/2019,0,,
904,#PresidentSanders trends as Vermont senator reportedly leads Democratic fundraising race,12/31/2019,1,,
905,Army bans TikTok following guidance from the Pentagon,1/2/2020,1,,
906,Emails show Pentagon warned Trump Ukraine aid freeze broke the law,1/3/2020,1,,
907,Flashback: Trump Warned That a 'Weak' and 'Ineffective' President Would Start a War With Iran to 'Get Re-elected',1/4/2020,2,,
908,President Donald Trump advised all Americans to flee Iran immediately,1/4/2020,2,,
909,The Anarchist Daughter of the GOP's Gerrymandering Mastermind Just Dumped His Maps and Files on Google Drive,1/7/2020,0,,
910,House to vote to limit Trump's military action against Iran without congressional approval,1/10/2020,0,,
911,"Video in apparent Epstein suicide attempt is lost, US says",1/11/2020,2,,
912,"A man in Seattle killed himself thinking that he hurt someone. A cop's lie led to his death, watchdog says",1/12/2020,2,,
913,Fact Check: Joe Biden Has Advocated Cutting Social Security for 40 Years,1/14/2020,1,,
914,Army Veteran Has Prosthetic Legs Repossessed After VA Refuses to Pay for Them,1/14/2020,1,,
915,"At the Iowa Debate, Bernie Sanders’s Most Vociferous Opponent Was CNN",1/15/2020,1,,
916,Wisconsin pastor worries some congregation members worship Trump more than Jesus,1/16/2020,1,,
917,Jewish Democratic group: Trump's school prayer push is an attack on church-state separation,1/18/2020,2,,
918,FBI: Saudi government almost certainly helps its citizens escape prosecution in US for serious crimes,1/19/2020,2,,
919,"America has spent $6.4 trillion on wars in the Middle East and Asia since 2001, a new study says",1/21/2020,0,,
920,"U.S. Supreme Court lets Flint, Michigan residents sue over water contamination",1/22/2020,0,,
921,New Jersey becomes first state to guarantee severance pay for mass layoffs,1/23/2020,0,,
922,Kobe Bryant and four others died today in a Helicopter Crash,1/27/2020,0,,
923,"Chipotle Fined $1.3 Million for More Than 13,000 Child Labor Violations",1/29/2020,0,,
924,Head of Harvard’s chemistry department arrested for lying about work with China,1/30/2020,1,,
925,Exclusive Poll: 80% of Young Voters Think 'Global Warming Is a Major Threat to Life as We Know It',1/31/2020,0,,
926,Rick Scott accused of erasing evidence in nursing home deaths,2/1/2020,0,,
927,Stable genius Trump congratulates wrong state for Kansas City Chiefs' Super Bowl win,2/3/2020,1,,
928,Kansas City Chiefs' Derrick Nnadi celebrates Super Bowl win by paying off KC Pet Project animal shelter adoption fees,2/4/2020,1,,
929,State of the Union: Parkland father Fred Guttenberg ejected for yelling out as Trump touted Second Amendment rights,2/5/2020,1,,
930,"Amazon paid a 1.2% tax rate on $13,285,000,000 in profit for 2019",2/6/2020,0,,
931,"Arizona Quietly Sells 16,810 Acres to Freeport-McMoRan for Mining Waste",2/7/2020,0,,
932,Facebook Hires Fox News Producer Who Has Poisoned Boomer Brains for Years,2/8/2020,2,,
933,"Trump's Trade War Will Cost Average Family $1,277 This Year, Budget Office Reveals",2/9/2020,2,,
934,Single-payer system could save US $600 billion in administrative costs,2/9/2020,2,,
935,"Oklahoma inmate died after pleas for help, many caught on video, were ignored for days, suit says",2/10/2020,1,,
936,14 more U.S. troops diagnosed with brain injury following Iranian missile attack,2/10/2020,1,,
937,"Young, liberal voters made the difference for Bernie Sanders",2/12/2020,1,,
938,Mike Bloomberg once blamed banks making loans to black Americans as the cause of the 2008 financial crash,2/14/2020,0,,
939,"Bernie Sanders surges to a 15 point lead over Biden, Bloomberg",2/19/2020,1,,
940,"Over 1,000 veterans speak out over Trump's 'sustained attacks' on Vindman",2/20/2020,0,,
941,Bernie Sanders releases plan for guaranteed child care and pre-K,2/24/2020,0,,
942,"Bernie Sanders Is Right: 'Medicare For All' Is Best For US, Scientific Studies Confirm",2/25/2020,0,,
943,"Sanders most searched, most tweeted about candidate during Democratic debate",2/26/2020,0,,
944,"US coronavirus tests are faulty and 'cannot be relied upon', New York says",2/29/2020,2,,
945,"🇨🇳 Uyghurs being used as forced labor for 80+ brands, many of them American. Including Apple, Amazon, Nike, GM, Google and others...",3/1/2020,2,,
946,"Bernie Sanders Leads Trump, All 2020 Candidates in Donations From Active-Duty Troops",3/1/2020,2,,
947,"Alaska Officials Angered, Alarmed By JP Morgan Chase’s Refusal To Finance Arctic Oil Projects: “JPMorgan Chase is expanding its commitment to a low-carbon economy and further supporting the clean energy transition,” the bank said.",3/2/2020,1,,
948,Pete Buttigieg is dropping out of the presidential race,3/2/2020,1,,
949,Man Hacks Into A Scammer's CCTV And Watches How A Tech Support Scam Unfolds While He's On The Phone With Them,3/3/2020,0,,
950,Greenpeace Gives Joe Biden a D- on Climate Change Report Card,3/5/2020,0,,
951,"Andrew Yang launches nonprofit aimed at making his former campaign's ideas a reality, also launches podcast: ""Our campaign grew so much because we had a clearer diagnosis of the problems that face our country and a real vision for how to solve them,"" Yang said in a statement.",3/6/2020,1,,
952,US Holocaust Museum Labels China’s Persecution of Uyghurs in Xinjiang ‘Crimes Against Humanity’,3/7/2020,2,,
953,"Our nation's capital, the District of Colombia, has the first positive case of coronavirus.",3/8/2020,2,,
954,The U.S. doesn't have enough ICU beds or ventilators to deal with even a moderate coronavirus outbreak,3/9/2020,0,,
955,"Virginia lawmakers vote to decriminalize marijuana, set $25 civil penalty for possession",3/10/2020,1,,
956,White House told federal health agency to classify coronavirus deliberations,3/12/2020,0,,
957,Coronavirus forces NCAA to cancel March Madness basketball tournaments,3/13/2020,1,,
958,Former Judge Resigns From the Supreme Court Bar,3/14/2020,2,,
959,Ivanka Trump works from home after interacting with official who tested for coronavirus,3/14/2020,2,,
960,The TSA Now Allows 12oz of Hand Sanitizer in Carry-On Luggage,3/15/2020,2,,
961,Maryland man fatally shot by police while asleep in his bedroom | US news,3/15/2020,2,,
962,Coronavirus: US man who stockpiled hand sanitiser probed for price gouging,3/16/2020,0,,
963,CDC recommends the cancellation of events with 50 or more people for the next eight weeks throughout US,3/16/2020,0,,
964,We need Ventilators — We Need You to Help Get Them Built,3/17/2020,1,,
965,"White House Wants to Send Individual $1,000 Stimulus Checks Now",3/18/2020,0,,
966,"Amazon closed its warehouse in Queens, NY after a worker tested positive for coronavirus",3/19/2020,1,,
967,"Senate approves coronavirus bill for sick leave, free testing. Bill now goes to Trump’s desk",3/19/2020,1,,
968,"GOP senators sold off their stocks ahead of coronavirus economic crash, reports say",3/20/2020,0,,
969,Sen. Kelly Loeffler reportedly 'dumped millions' in stock before coronavirus tanked markets,3/20/2020,0,,
970,"Woman who flew from U.S. to China for Coronavirus test faces criminal charges: A woman who flew from Massachusetts to Los Angeles — then to Beijing, where she tested positive — is under investigation on allegations of concealing her symptoms and putting fellow travelers at risk of infection.",3/20/2020,0,,
971,"Sens. Dianne Feinstein, Jim Inhofe made stock trades before coronavirus pandemic",3/21/2020,2,,
972,Washington Post: US intelligence warned Trump in January and February as he dismissed coronavirus threat,3/22/2020,2,,
973,This 39-year-old New Orleans woman tested for coronavirus. She died before getting her results.,3/22/2020,2,,
974,College students in Florida test positive for coronavirus after spring break trip,3/23/2020,0,,
975,Hospitals Need to Repair Ventilators. Manufacturers Are Making That Impossible,3/23/2020,0,,
976,"Tito’s vodka will make hand sanitizer during coronavirus pandemic. 'Currently, we are testing our formula, procuring necessary components of supplies and packaging, and preparing for production as we wait for the additional required ingredients to be delivered to the distillery,' the company said.",3/24/2020,1,,
977,"Hanes will start making masks. 'Hanes expects to ramp up to production of 1.5 million masks weekly, and the consortium of companies it has joined, led by Parkdale Mills America expected to ramp up to production of 5 million to 6 million masks weekly using HanesBrands’ design and patterns'",3/24/2020,1,,
978,"The US is confronting coronavirus without the CDC. It's 'like fighting with one hand tied behind your back,' ex-director says.",3/25/2020,1,,
979,Exclusive: U.S. slashed CDC staff inside China prior to coronavirus outbreak,3/26/2020,1,,
980,"Missouri loosens testing criteria for COVID-19, opening door for more sick people to get tests",3/26/2020,1,,
981,"Trump’s campaign is trying to remove a video of him appearing to call the coronavirus a ‘hoax,’ saying it’s misleading",3/27/2020,0,,
