Index,title,date,Label_News,,
1,"Two Cops Taser Black Man Trying To Pick Up His Kids From School, in Minnesota for doing nothing wrong",8/30/2014,2,,
2,"Video shows S.C. trooper shoot unarmed, cooperative man",9/25/2014,0,,
3,'Unintelligent' blacks 'brainwashed' to choose street cred over success: Charles Barkley,10/26/2014,2,,
4,Netflix is Planning to put an End to Geographical Blocking,1/22/2015,1,,
5,Measles returns: Of vaccines and vacuous starlets - A rise in anti-vaccine sentiment has put everyone at risk,1/30/2015,0,,
6,Ellen Pao's Husband accused of cheating Massachusetts and Louisiana cops and firefighters out of more than $100 million and not paying close to $3 million in taxes.,6/12/2015,0,,
7,"Judge rules Ellen Pao must pay $276,000 to Kleiner Perkins to reimburse the venture capital firm for its expenses during the five-week trial",6/18/2015,1,,
8,Supreme Court Declares Same-Sex Marriage Legal In All 50 States,6/26/2015,1,,
9,Too Much Praise Promotes Narcissism: The first longitudinal study in children supports the theory that parents with unrealistically positive views of their kids foster narcissistic qualities,7/12/2015,2,,
10,"Police are Killing Native Americans at Higher Rate than Any Race, and Nobody is Talking About It",8/3/2015,0,,
11,"Police kill a white teen, and the silence raises questions",8/7/2015,0,,
12,"The Coddling of the American Mind: In the name of emotional well-being, college students are increasingly demanding protection from words and ideas they don’t like. Here’s why that’s disastrous for education—and mental health.",8/11/2015,0,,
13,Family Values Activist Josh Duggar Had a Paid Ashley Madison Account,8/20/2015,0,,
14,Cameraman and Reporter shot during live interview. Gunman on the run,8/26/2015,1,,
15,The hero Army veteran who was shot five times as he 'charged at Oregon college shooter',10/2/2015,1,,
16,"An anti-animal cruelty group says it has secretly recorded Tyson Foods workers punching, throwing and pulling the heads off of live broiler chickens at one of the mega meat producer's plants in Mississippi where up to 2.5 million chickens are slaughtered each week.",10/29/2015,0,,
17,Court says it’s again legal for NSA to spy on you because Congress says it’s OK,10/30/2015,0,,
18,New Poll Shows 60% of Americans Think Hillary Clinton is Untrustworthy and Dishonest,11/8/2015,2,,
19,White supremacists charged in terror plot,11/17/2015,1,,
20,"Maine Wants Candy, Soda Excluded From Food Stamps",11/27/2015,1,,
21,"Leaked Documents Reveal Dothan Police Department Planted Drugs on Young Black Men For Years, District Attorney Doug Valeska Complicit",12/2/2015,0,,
22,"Cop Ruthlessly Beats his k9 Dog, Picks Animal Up and Rams Its Body Into the Ground",12/24/2015,0,,
23,California law allowing seizure of guns without notice begins Jan. 1,12/30/2015,0,,
24,U.S. adds 2.65 million jobs in 2015 for 2nd best year since 1999,1/8/2016,0,,
25,"Since 9/11, according to congressional reports, U.S. taxpayers have given Pakistan at least eighteen billion dollars, much of it to the military. Last year alone, the U.S. gave Pakistan $1.5 billion dollars.",1/26/2016,1,,
26,Man Charged for Throwing Tomatoes at Donald Trump During Iowa City Stop,1/28/2016,1,,
27,MSNBC cuts away from Bernie Sanders as he condemns Trans-pacific partnership,2/24/2016,1,,
28,Ku Klux Klan rally in Anaheim erupts in violence; three stabbed,2/28/2016,2,,
29,NY judge: US cannot make Apple provide iPhone data,3/1/2016,1,,
30,"NSFW Cop with hand on gun intentionally walks up to dog to shoot it, owner stops him and then gets assaulted.",3/4/2016,1,,
31,"Liberal-leaning Vermont could become the first U.S. state to legalize recreational marijuana use through legislation, rather than by voter initiative, in a move that advocates for the drug say could speed its acceptance across the nation.",3/15/2016,1,,
32,Cops: Gun store owner stops would-be campus shooter,3/29/2016,1,,
33,Man Faces Life In Prison For Stealing $31 Worth Of Candy,4/5/2016,0,,
34,"Bill Nye Says Climate Change Denial Is ""Running Out of Steam,"" Thanks to Millennials",4/9/2016,2,,
35,Supreme court considers taking case of man given life in prison for growing pot,4/16/2016,2,,
36,"54,000 Brooklyn voters ‘vanish’ ahead of primary day",4/20/2016,1,,
37,Harriet Tubman to be first African-American on U.S. currency,4/21/2016,0,,
38,"Trump Accused Of Fraud & will go to trial, N.Y. judge rules, Trump could testify during campaign",4/27/2016,1,,
39,"Teen birthrate hits all-time low, led by 50 percent decline among Hispanics and blacks",4/29/2016,0,,
40,"Abortion Clinics In Blue States Are Closing, Too",5/2/2016,1,,
41,"Denied Breaks, U.S. Poultry Workers Wear Diapers on the Job",5/12/2016,1,,
42,Female General Becomes First Woman to Lead US Military Combat Command,5/16/2016,1,,
43,"Hillary Clinton’s Energy Initiative Pressed Countries to Embrace Fracking, New Emails Reveal",5/24/2016,1,,
44,"The innovative diamond design of highways has been implemented in 62 intersections across 22 states and since 2009, so far, has worked",6/7/2016,1,,
45,A United Nations whistleblower who was suspended for exposing the sexual abuse of children by peacekeepers has resigned over the organization’s failure to hold senior officials to account,6/8/2016,1,,
46,Rapist Brock Turner gets lifetime ban from Team USA swimming,6/10/2016,0,,
47,50 Killed in Florida Nightclub Shooting,6/12/2016,2,,
48,"Florida Nightclub Shooting: Around 20 Killed, 42 Injured, Say Police",6/12/2016,2,,
49,ISIS Officially Claims Responsibility For Orlando Massacre,6/13/2016,0,,
50,Gunmakers' shares jump after Orlando nightclub massacre,6/14/2016,0,,
51,U.S. top court tosses Puerto Rico's debt restructuring law,6/14/2016,0,,
52,Toddler dragged by gator into water near Disney's Grand Floridian,6/15/2016,0,,
53,"Killings of LGBT and HIV-affected people rose 20% in 2015, report finds",6/15/2016,0,,
54,Yale may cave on English poets course after students called it 'too white',6/16/2016,1,,
55,Philadelphia Becomes 1st Major U.S. City To Pass A Tax On Soda,6/17/2016,0,,
56,Starbucks Cards Hold So Much Money The Company Could Be A Mid-Sized Bank,6/20/2016,1,,
57,Trump directs nearly one-fifth of his money to his own businesses,6/22/2016,0,,
58,Donald Trump on Pace to Raise Less Money Than Almost Any Presidential Candidate in Modern Era,6/22/2016,0,,
59,"Heroin use at 20-year high in U.S. drug 'epidemic', U.N. says",6/23/2016,1,,
60,NYC faked day care centers' lead water level test records,6/25/2016,2,,
61,Ban on transgender troops to be lifted July 1,6/26/2016,2,,
62,The U.S. Supreme Court decision making it harder to prosecute public officials could help U.S. Senator Robert Menendez (D-NJ) as he fights federal corruption charges [re: possible impact of Bob McDonnell case],6/29/2016,1,,
63,No charges for concealed carrier who wounded South Carolina club shooter,7/5/2016,0,,
64,Streetlights May Be Hurting Public Health,7/6/2016,1,,
65,"Reports of shots fired at downtown Dallas rally following deaths of Alton Sterling, Philando Castile",7/8/2016,1,,
66,Arizona is site of largest current US measles outbreak,7/9/2016,2,,
67,"She wasn't a cop and she wasn't white, but she took a bullet in Dallas while protecting her sons",7/11/2016,1,,
68,"No racial bias in police shootings, study by Harvard professor shows",7/14/2016,1,,
69,Everything we love to eat is a scam,7/15/2016,1,,
70,Former Fox News commentator sentenced to prison for faking CIA ties,7/16/2016,2,,
71,LAPD Investigating Playboy Model Who Shared Body-Shaming Photo of Naked Woman Secretly Shot at Gym,7/17/2016,2,,
72,"Secretary Kerry's Call With Turkish Minister. Turkish government officials on Saturday said they would view the U.S. as an enemy if the Obama administration doesn’t hand over Mr. Gülen, who is a reclusive but influential Turkish cleric living in self-imposed exile in the U.S. for nearly two decades.",7/18/2016,1,,
73,"Three officers dead; 1 suspect dead as officers work active shooting on Airline Highway in Baton Rouge, Louisiana",7/18/2016,1,,
74,The feds want to launch peanut butter drone strikes to save endangered ferrets,7/19/2016,1,,
75,"Police Capt. Robert Melton has died; second Kansas City, Kansas officer shot and killed in two months",7/20/2016,1,,
76,"Faced with 30 years in prison, New Jersey actor takes plea deal on gun charge - comedian/actor faced charges for possessing a BB gun while filming a movie last year",7/21/2016,0,,
77,"Police: Ex-Marine, 81, held hostage in motel for 4 years",7/23/2016,2,,
78,Leaked DNC Documents Show Plans To Reward Big Donors With Federal Appointments,7/25/2016,0,,
79,Wasserman Schultz resigning as party leader,7/25/2016,0,,
80,DNC Leak Shows Mechanics of a Slanted Campaign,7/26/2016,0,,
81,Freddie Gray case: Charges against three remaining officers dropped,7/28/2016,0,,
82,Turkey surrounds NATO US nuclear base. Turkish troops have sealed off Incirlik base.,8/1/2016,0,,
83,Homeownership Rate in the U.S. Drops to Lowest Since 1965,8/2/2016,0,,
84,"With 1 vote today, New Jersey will make it harder to graduate from high school",8/4/2016,1,,
85,Penthouse Magazine Targets Utah For Declaring Pornography A Health Crisis,8/7/2016,2,,
86,HOAs from hell: Homes associations that once protected residents now torment them,8/8/2016,0,,
87,"Woman, 73, fatally shot by Florida officer role-playing as ‘bad guy’ during citizen police academy",8/11/2016,1,,
88,Study: High levels of toxic chemicals in drinking water of 6 million Americans,8/12/2016,0,,
89,"5 dead, 19 wounded in Chicago shootings in less than 24 hours",8/15/2016,1,,
90,"Jury: Pennsylvania Attorney General Kane guilty of perjury, obstruction, all other charges",8/16/2016,0,,
91,"In an unprecedented move, Montana Fish, Wildlife and Parks is closing 183 miles of the Yellowstone River from Gardiner to Laurel to all water-based recreation — fishing, wading, floating, tubing, boating — due to a parasite outbreak.",8/20/2016,2,,
92,"FBI found nearly 15,000 new Hillary Clinton emails - Washington Times",8/22/2016,0,,
93,"U.S. Army fudged its accounts by trillions of dollars, auditor finds",8/23/2016,0,,
94,Georgia man who threw boiled water on gay men gets 40 years,8/25/2016,0,,
95,Dr Drew fired by CNN for talking about Clinton's health,8/26/2016,0,,
96,Donald Trump wants to track U.S. entrants to ensure they don't overstay their visas,8/28/2016,2,,
97,Gene Wilder Dead: ‘Young Frankenstein’ Star Was 83,8/30/2016,0,,
98,Clinton emailed classified information after leaving State Dept. | New York Post,8/31/2016,0,,
99,A record number of Americans now dislike Hillary Clinton,8/31/2016,0,,
100,FBI Recovers 30 Hillary Clinton Emails Involving Benghazi Attack | TIME,8/31/2016,0,,
101,Virginia: Man dies in Hampton Roads Regional Jail 2 days after filing emergency grievance begging for help,9/1/2016,1,,
102,Remember Brock Turner? From 3 Months Ago? He'll Leave Jail On Friday.,9/1/2016,1,,
103,The DEA thinks herbal supplement kratom is as dangerous as heroin,9/3/2016,2,,
104,FBI Says a Laptop That Held Clintonâs E-Mails Has Gone Missing,9/3/2016,2,,
105,New ISIS Military Commander Was Trained by State Department as Recently as 2014 | PJ Media,9/7/2016,0,,
106,Female WWII pilot will finally be laid to rest at Arlington,9/8/2016,0,,
107,More State Department Docs Show Hillary Should Have Been Aware of Classification Rules | The Weekly Standard,9/9/2016,0,,
108,CDC Director: 'Essentially out of money' to fight Zika,9/11/2016,2,,
109,"Hillary Clinton has pneumonia, doctor says - POLITICO",9/12/2016,1,,
110,Colin Powell Called Benghazi ‘Stupid Witch Hunt’ In Email To Condi Rice,9/14/2016,0,,
111,"New York Teen Dies from Brain-Eating Amoeba After Contracting Infection on Vacation: 'She Was a Shining Light,' Says Mom",9/14/2016,0,,
112,American trust in news media falls to lowest level in history: Gallup poll,9/15/2016,1,,
113,Abducted Woman Calls 911 as Alleged Captor Sleeps – Leading to Discovery of 3 More Bodies,9/16/2016,0,,
114,"California added 63,000 jobs in August, 42% of U.S. total",9/17/2016,2,,
115,Device near New Jersey train station explodes while FBI investigates,9/19/2016,0,,
116,"Tulsa, OK Police Officer Betty Shelby Shot Unarmed Man With Hands Up",9/20/2016,0,,
117,"Chris Christie Knew About Bridge Lane Closings as They Happened, Prosecutors Say",9/20/2016,0,,
118,"Paul Combetta, 'Stonetear,' and the Reddit Thread that could Rock Hillary Clinton | The Daily Dot",9/21/2016,1,,
119,45 Congressmen Ask DEA Not to Ban Kratom Next Week,9/24/2016,2,,
120,Officer accused of murdering 6-year-old claims self-defense,9/26/2016,0,,
121,"'Disgruntled' Houston lawyer wearing Nazi uniform opens fire at strip mall; nine injured, suspect shot dead by police",9/27/2016,1,,
122,A black 17-year-old reported his stolen car using an app ... and police reportedly arrested him instead,9/30/2016,1,,
123,WikiLeaks plans to release documents on US election and Google over the next ten weeks,10/4/2016,0,,
124,"Yahoo helped the U.S. government spy on emails, report says",10/5/2016,1,,
125,DOJ will pursue criminal contempt charge against Sheriff Joe Arpaio,10/12/2016,1,,
126,"Colorado pot isn’t affecting Kansas like you think - Kansas State Attorney General Derek Schmidt surveyed the state's law enforcement agencies, with some interesting results.",10/13/2016,1,,
127,"HPD: 911 operator says ""ain't nobody got time for this"" and hangs up on callers",10/14/2016,0,,
128,Librarian Arrested at Kansas City Public Library for Defending Free Speech,10/15/2016,2,,
129,"Freed From Gag Order, Google Reveals It Received Secret FBI Subpoena",10/16/2016,2,,
130,WikiLeaks releases transcripts of Clinton Goldman Sachs speeches,10/16/2016,2,,
131,Study: 'Only' 36 percent of Colorado residents would kill someone for money,10/18/2016,1,,
132,Thousands of California soldiers forced to repay enlistment bonuses a decade after going to war,10/23/2016,2,,
133,South Korean Adopted At Age 3 Is To Be Deported Nearly 40 Years Later,10/28/2016,0,,
134,Recent Poll Shows More Americans Want Clinton Indicted than Want Her to Be President,10/29/2016,2,,
135,Two women busted for election fraud in Miami-Dade,10/29/2016,2,,
136,FBI director James Coney accused of breaking law as Hillary Clinton's 12-point lead 'wiped out': Monday US election briefing,11/1/2016,0,,
137,"The man arrested after authorities found a woman chained on his property in rural South Carolina killed at least seven people, and his confessions have solved a 13-year-old case, Sheriff Chuck Wright said Saturday.",11/6/2016,2,,
138,Idaho mom loses custody of children after giving daughter marijuana butter to relieve seizures,11/8/2016,1,,
139,This is Donald Trump's contract for the first 100 days as POTUS,11/10/2016,1,,
140,Glenn Greenwald: Trump will have vast powers. He can thank Democrats for them.,11/12/2016,2,,
141,"Anti-Trump protests, some violent, erupt for 3rd night nationwide",11/12/2016,2,,
142,"Puerto Rico's solution to heroin crisis: one-way tickets to Philly - Since the late 1990s, pastors, police, and mayors in Puerto Rico have been sending hundreds of heroin addicts, many of them HIV-positive, to Philadelphia, New York, Chicago, and other cities.",11/13/2016,2,,
143,Lafayette woman faces criminal charges after falsely claiming Trump supporters attacked her,11/13/2016,2,,
144,"Donald Trump Says He Won’t Take A Salary While President. “I’ll take $1 a year,” he vowed.",11/14/2016,0,,
145,Day Five of Anti-Trump: Protests Planned in a Number of Cities,11/14/2016,0,,
146,"Trump, Putin agree in phone call to improve ‘unsatisfactory’ relations between their countries, Kremlin says",11/15/2016,1,,
147,Almost 60 per cent of Americans say President-elect Donald Trump should compromise with Democrats,11/17/2016,1,,
148,'Making a Murderer': Brendan Dassey to Be Released by End of Week,11/17/2016,1,,
149,Donald Trump's 'new national security adviser' thinks fear of Muslims is 'rational',11/18/2016,1,,
150,Trump agrees to $25 million settlement in Trump University fraud cases,11/19/2016,2,,
151,Standing Rock protest: hundreds clash with police over Dakota Access Pipeline,11/21/2016,1,,
152,Dallas woman faked a pregnancy - then killed another woman and stole her baby: police,11/23/2016,1,,
153,Wal-Mart loses minimum wage pay fight as jury awards California truck drivers $54 million,11/24/2016,2,,
154,Wisconsin Agrees To Presidential Vote Recount At Third-Party Candidates' Request,11/26/2016,2,,
155,Reddit CEO admits editing pro-Trump users' comments,11/26/2016,2,,
156,Bernie Sanders to propose Outsourcing Prevention Act to keep jobs in US,11/27/2016,2,,
157,"Clinton campaign will participate in Wisconsin recount, with an eye on ‘outside interference,’ lawyer says",11/27/2016,1,,
158,UPDATE: Governor orders immediate evacuation of Dakota Access...,11/29/2016,0,,
159,Kansas judge rules sperm donor not on hook for child support,11/30/2016,1,,
160,BREAKING: Sheriff's Dept to Fine People $1K for Bringing in Food and Supplies to Standing Rock,12/1/2016,2,,
161,Next test for pipeline protesters: the North Dakota winter,12/3/2016,2,,
162,America Needs a Sane Left -- Radicalism at one end of the political spectrum means radicalism at the other [Opinion],12/4/2016,0,,
163,"North Carolina man told police he went to Comet Ping Pong pizzeria in D.C. with assault rifle to ‘self-investigate’ election-related conspiracy theory, charged with assault with a dangerous weapon",12/5/2016,0,,
164,Federal Officials to Explore Different Route for Dakota Pipeline,12/5/2016,1,,
165,"To Reduce Infant Mortality, U.S. Cities Adopt the Finland Way",12/6/2016,1,,
166,"As her rapist seeks to have a relationship with her child, a Massachusetts woman is appealing to the highest court in the state.",12/8/2016,1,,
167,Sandy Hook denier arrested after death threats made to parent of victim,12/9/2016,1,,
168,"Heroin deaths surpass gun homicides for the first time, CDC data shows",12/10/2016,2,,
169,"The Number of Marijuana Jobs Could Triple in the Years to Come. The pot industry could add up to 300,000 additional jobs, according to analysts.",12/12/2016,1,,
170,Ex-Philadelphia congressman gets 10 years for corruption,12/13/2016,1,,
171,Sen. Rand Paul Pushes For Probe Into Russia's Election Hacking,12/14/2016,0,,
172,"Ohio Supreme Court rules damages cap means girl raped by minister will get $250,000 — not $3.5 million",12/15/2016,1,,
173,New DEA rules aim to outlaw medicinal marijuana CBD extracts,12/16/2016,0,,
174,Police charge Muslim woman who falsely claimed she was called a 'terrorist' on the subway,12/16/2016,0,,
175,"Aging baby boomers increasingly embrace marijuana, heavy alcohol use",12/18/2016,2,,
176,DEA Quietly Classifies CBD Oil as Schedule 1 Drug,12/19/2016,1,,
177,"Four more officials charged over Flint, Michigan, water crisis",12/21/2016,0,,
178,Walmart Pulling Some 'Black Lives Matter' Clothes After Police Union Complains,12/22/2016,0,,
179,Man gets $75 after being wrongly imprisoned for 31 years,12/23/2016,1,,
180,Nuke Experts Say Trump’s Tweet Is ‘A Very Bad Sign’,12/23/2016,1,,
181,Carrie Fisher Dies at 60,12/28/2016,0,,
182,The Pentagon has struggled with a jump in child abuse in military families since America went to war,12/30/2016,0,,
183,Report: Megyn Kelly To Leave Fox News For NBC,1/4/2017,1,,
184,4 arrested in Facebook Live beating,1/5/2017,0,,
185,"In Tampa, Food Not Bombs activists arrested for feeding the homelessâagain",1/9/2017,0,,
186,US agrees to pay billions to Marines affected by toxic water - The Obama administration has agreed to provide disability benefits totaling more than $2 billion to veterans who had been exposed to contaminated drinking water while assigned to Camp Lejeune in North Carolina.,1/13/2017,0,,
187,"CIA director rips into Donald Trump over tweets, Russia",1/16/2017,2,,
188,Anti-Trump protesters block some entry points to inauguration,1/20/2017,1,,
189,"Congress moves to give away national lands, discounting billions in revenue and millions of jobs",1/20/2017,1,,
190,Trump's first executive action: Cancel Obama's mortgage premium cuts,1/23/2017,1,,
191,"Trump signs order withdrawing from TPP, reinstate 'Mexico City policy' on abortion",1/24/2017,1,,
192,California steaming: Democrats are learning to invoke states’ rights -- America’s most progressive state is set to lead the new fight against federal power,1/25/2017,1,,
193,Trump White House senior staff have private RNC email accounts,1/26/2017,1,,
194,Donald Trump’s chief economic advisor set to receive $284m payday from Goldman Sachs,1/26/2017,1,,
195,Standing Rock Sioux tribe says Trump is breaking law with Dakota Access order,1/27/2017,0,,
196,Minnesota protesters erupt after Republicans pass bill to charge demonstrators for police overtime costs,1/28/2017,2,,
197,A bill has already been introduced in Congress to remove the US from the United Nations,1/30/2017,0,,
198,Trump Fires Acting Attorney General,1/31/2017,0,,
199,"Billionaire Trump Adviser Peter Thiel Bought His New Zealand Citizenship, Documents Show",2/3/2017,1,,
200,Mike Pence: Trump ‘Has Every Right to Criticize’ Other Branches of Government,2/6/2017,1,,
201,Nearly 500 arrested in California human trafficking raids,2/6/2017,1,,
202,Trump makes false statement about U.S. murder rate to sheriffs’ group,2/8/2017,1,,
203,Kellyanne Conway Tells Americans To Buy Ivanka Trump's Products,2/10/2017,1,,
204,"Trump Signs 3 Executive Orders Targeting Drug Cartels, Crimes Against Police",2/10/2017,1,,
205,Revealed: FBI terrorism taskforce investigating Standing Rock activists | US news,2/11/2017,2,,
206,Republican green-card holder who voted illegally in Texas gets 8 years in prison,2/12/2017,2,,
207,"188,000 evacuated, emergency declared as California’s massive Oroville Dam threatens floods",2/13/2017,1,,
208,Trump campaign aides had repeated contacts with Russian intelligence,2/15/2017,1,,
209,White House posts wrong versions of Trump's orders on its website,2/15/2017,1,,
210,Donald Trump knew for weeks that Michael Flynn withheld the truth on his call with Russia,2/16/2017,0,,
211,FBI arrests man in Myrtle Beach allegedly planning attack 'in the spirit of Dylann Roof',2/17/2017,1,,
212,Oklahoma just hit temperatures of 100 Fahrenheit in the depths of winter,2/18/2017,2,,
213,Education Secretary DeVos criticized teachers at D.C. school she visited — and they're not having it.,2/19/2017,2,,
214,The Resistance Is Winning As Trump Whines About Senate Democrats Refusing To Work With Him,2/19/2017,2,,
215,Republican Health Proposal Would Redirect Money From Poor to Rich,2/19/2017,2,,
216,Former Swedish PM: More murders in Florida where Trump spoke than in Sweden last year,2/20/2017,2,,
217,"Up to 200 headstones damaged at Jewish cemetery, director says",2/22/2017,1,,
218,You No Longer Need A License To Carry A Concealed Weapon In New Hampshire,2/23/2017,0,,
219,"Next month, the U.S. Supreme court will hear its first transgender rights case. This is the high school student behind it.",2/24/2017,1,,
220,"Mother finds missing teenage daughter being sold on website, fights back - Kubiiki Pride was scrolling through ads on Backpage.com when she saw an ad selling something that belonged to her. It was her missing 14-year-old daughter.",2/25/2017,2,,
221,Justice Department will again use private prisons,2/26/2017,2,,
222,Attorney General Sessions has said 'good people don't smoke marijuana' — that belief could lead to fuller jails,2/27/2017,1,,
223,Trump says Obama behind leaks,2/28/2017,0,,
224,Trump wants to add $54 billion to defense budget while slashing domestic spending and foreign aid,2/28/2017,0,,
225,Nigerian engineer handed written test at New York airport - BBC News,3/2/2017,0,,
226,"The Kansas Supreme Court on Thursday ruled unanimously that state funding to schools is inadequate and gave the Legislature a June deadline to enact changes, scrambling a legislative session already consumed by a sprawling budget debate.",3/3/2017,0,,
227,"Sikh man shot in an apparent hate crime in Kent, near Seattle WA.",3/5/2017,2,,
228,Sen. Tim Kaine’s son among several arrested after protesters disrupt Trump rally in Minnesota,3/9/2017,0,,
229,"Poland will seek the arrest and extradition of a Minnesota man exposed by The Associated Press as a former commander in an SS-led unit that burned Polish villages and killed civilians in World War II, prosecutors said Monday.",3/14/2017,0,,
230,The federal government has no idea how to grow marijuana. The US grows marijuana for research. But it’s so awful it’s basically useless.,3/15/2017,1,,
231,Conservative Oklahoma senator charged with three felonies after child prostitution investigation,3/17/2017,0,,
232,"Kentucky: Louisville Mayor Greg Fischer announced Friday that he has asked the FBI to investigate what he called “our worst nightmare,” the alleged sexual abuse of children in the police department’s Youth Explorer program.",3/18/2017,2,,
233,NYPD officers who assaulted postal worker acquitted by judge.,3/18/2017,2,,
234,Chuck Berry Dies at 90; Helped Define Rock 'n' Roll,3/19/2017,2,,
235,Waiter fired after asking Latinas for 'proof of residency' at upscale Huntington Beach eatery,3/20/2017,0,,
236,Texas teacher charged with improper relationship with a student,3/22/2017,1,,
237,"Bernie Sanders thinks this $89,000-a-year drug should be $1,000 a year",3/23/2017,1,,
238,"Report: Bannon told conservatives 'this is not a debate,' you have to back bill.",3/26/2017,2,,
