Index,title,date,Label_News,,
239,Devin Nunes Vanished the Night Before He Made Trump Surveillance Claims. The Republican intelligence chairman got a message and jumped out of an Uber. The next morning he dropped a bombshell based on classified information.,3/26/2017,2,,
240,States Give New Parents Baby Boxes To Encourage Safe Sleep Habits,3/27/2017,1,,
241,Congress just voted to let ISPs sell your browsing history to advertisers,3/29/2017,0,,
242,Three teenage burglars shot dead in US,3/29/2017,0,,
243,"White House stacked with millionaires, financial disclosures reveal.",4/2/2017,2,,
244,"The IRS took millions from innocent people because of how they managed their bank accounts, Inspector General finds",4/5/2017,0,,
245,Police violently drag man from United plane after airline reportedly overbooked flight,4/10/2017,0,,
246,Police: Shooting reported at elementary school in San Bernardino,4/11/2017,1,,
247,United States' first female Muslim judge found dead in Hudson River,4/13/2017,0,,
248,Last surviving person born in 1800s dies at age 117,4/16/2017,2,,
249,Trump privately signs anti-Planned Parenthood law,4/17/2017,1,,
250,"Police announce $50,000 reward for arrest of Facebook killer as search intensifies",4/18/2017,0,,
251,Aaron Hernandez commits suicide in prison,4/19/2017,0,,
252,Cleveland murder suspect Steve Stephens kills himself after pursuit,4/19/2017,0,,
253,Bill O’Reilly Severance: Fox News Host to Get $25 Million,4/21/2017,0,,
254,"Appalachian Power president says company is looking toward renewables - “At the end of the day, West Virginia may not require us to be clean, but our customers are.”",4/23/2017,2,,
255,New Orleans begins controversial removal of Confederate monuments,4/24/2017,1,,
256,Convicted terrorist admits she lied to become US citizen,4/27/2017,0,,
257,Donald Trump signs executive order that could allow companies to mine and drill for oil at national monuments,4/27/2017,0,,
258,Miami doctor’s call to broker during baby’s delivery leads to $33.8 million judgment,4/30/2017,2,,
259,FCC opens investigation into Stephen Colbert’s controversial Trump insult,5/6/2017,2,,
260,Woman who said Johnson's baby powder gave her cancer wins $110.5 million in lawsuit,5/7/2017,2,,
261,FBI Director James Comey Is Fired by Trump,5/10/2017,0,,
262,"Florida: Former U.S. Rep. Corrine Brown was convicted Thursday on 18 counts of conspiracy, mail and wire fraud, and tax charges.",5/12/2017,1,,
263,Trump asked Comey to end investigation of Michael Flynn: source,5/17/2017,0,,
264,Fox News' ex-CEO Roger Ailes dead,5/18/2017,1,,
265,U.S. households now have as much debt as they had in 2008,5/23/2017,1,,
266,"Clinton: Trump's budget shows ""unimaginable level of cruelty""",5/24/2017,1,,
267,Trump budget would sell entire U.S. Northeast gasoline reserve,5/24/2017,1,,
268,"Walmart to ban woman who told customer to 'go back to Mexico,' called another the N-word",5/26/2017,1,,
269,Witnesses: Man Cut the Throats of Two MAX Passengers Who Tried to Stop Anti-Muslim Bullying of Women on Northeast Portland Train,5/27/2017,2,,
270,"After Trump announcement, Minnesota will proceed with its own climate change strategy - With a plan adopted in 2007, the state has been a national leader in pursuing an aggressive plan to reduce emissions.",6/2/2017,1,,
271,"Doorway to profit: When bosses visit the White House, their firms make more money -- White House visitor logs help show that lobbying pays",6/2/2017,1,,
272,Walmart is asking employees to deliver packages on their way home from work,6/4/2017,2,,
273,Accused Leaker of Top-Secret U.S. Report Loses Bail Request,6/9/2017,1,,
274,White Professor Fired From Black College Gets $4.9 Million,6/10/2017,2,,
275,"Trump, in Miami speech, set to roll back Obama's Cuba policy",6/11/2017,2,,
276,Bernie Sanders says Alexandria shooter was campaign volunteer,6/15/2017,1,,
277,"Special counsel Mueller investigating Jared Kushner's finances, Washington Post reports",6/16/2017,1,,
278,Polygamous sect leader Lyle Jeffs captured after a year on the run,6/16/2017,1,,
279,Kentucky Coal Mining Museum converts to solar power,6/19/2017,1,,
280,Tour group says no more Americans to North Korea after Warmbier's death,6/20/2017,0,,
281,"White House blocks cameras, CNN hires sketch artist",6/24/2017,2,,
282,Billionaire Warren Buffett says 'the real problem' with the US economy is people like him,6/28/2017,1,,
283,"Poll: Americans feel 'alarmed' and 'uneasy' about Trump, Washington",6/30/2017,1,,
284,US woman shoots boyfriend dead in YouTube stunt to 'boost online profile',6/30/2017,1,,
285,Maine and New Jersey state governments shut down by budget failures,7/2/2017,2,,
286,Nevada launches sales of legal recreational marijuana,7/2/2017,2,,
287,Buzz Aldrin’s many faces during Trump’s space speech,7/4/2017,2,,
288,Now 44 States Have Refused Trump Commission's Demand For Personal Info On Voters,7/5/2017,0,,
289,Trump moves to dismiss lawsuit from woman who accused him of assault,7/9/2017,2,,
290,"Audio Interview Confirms Dejuan Guillory Was Unarmed, Lying on Ground When Cop Shot Him in the Back",7/11/2017,0,,
291,"30 people shot, 3 fatally, in 18 hours in Chicago",7/17/2017,0,,
292,Disgraced former U.S. House Speaker Dennis Hastert faces sex-offender treatment with prison release,7/19/2017,1,,
293,Cop Suspended After Body Camera Video Shows Him Planting Drugs,7/20/2017,0,,
294,"Donald Trump reportedly exploring ways to hamper Russia probe, pardon himself",7/21/2017,0,,
295,Sessions: Trump Directed Law Enforcement Agencies to Go After Darknet Markets Like AlphaBay,7/21/2017,0,,
296,Tennessee county inmates offered reduced jail time for getting a vasectomy,7/22/2017,2,,
297,Teens who laughed as man drowned will face charges,7/24/2017,0,,
298,Trump: no transgender people will serve in U.S. military - Twitter,7/26/2017,1,,
299,"Trump, Scaramucci distract from ‘most important,' chilling Senate hearing",8/1/2017,1,,
300,"Amazon jacked up Prime Day prices, misleading consumers, says vendor",8/2/2017,1,,
301,Chicago Public Schools to pay $850 million in interest on $500 million loan,8/5/2017,2,,
302,"Protesters Swarm Trump Tower After Charlottesville: ‘No Trump, No KKK, No Fascist USA!’",8/14/2017,1,,
303,Holocaust Memorial in Boston damaged for second time this summer,8/15/2017,0,,
304,"Trump is Totally Wrong, Anti-Racist Protesters Actually Did Have Permits",8/17/2017,0,,
305,Court: Johnson & Johnson ordered to pay $417M in civil lawsuit linking talcum powder to cancer,8/22/2017,1,,
306,More than 200 doomed Puerto Rico dogs saved by airlift to US,8/26/2017,2,,
307,"‘Nazi scum,’ ‘Die Nazi!’ painted across Republican headquarters in Lexington",8/27/2017,2,,
308,Leonardo DiCaprio Just Gave $1 Million Toward Hurricane Harvey Relief Efforts,9/1/2017,1,,
309,"Video shows Utah nurse screaming, being handcuffed after refusing to take blood from unconscious victim",9/2/2017,2,,
310,DOJ confirms Obama did not wiretap Trump during 2016 campaign,9/3/2017,2,,
311,Utah nurse who was arrested says officer was on a 'war path',9/5/2017,0,,
312,Police Officer Who Arrested Utah Nurse Gets Fired From Medic Job,9/6/2017,0,,
313,Florida Declares State of Emergency as Hurricane Irma Becomes Category 5 Superstorm,9/6/2017,0,,
314,Hurricane Irma: Florida sheriff warns sex offenders not welcome at storm shelters,9/8/2017,1,,
315,Equifax execs sold stock before hack was disclosed,9/9/2017,2,,
316,Florida Risks More Irma Devastation Because Gov. Rick Scott Defunded Wetlands Agency,9/10/2017,2,,
317,New Hampshire family says 8-year-old biracial boy injured after he was hung from a tree,9/12/2017,1,,
318,Equifax hit with at least 23 class-action lawsuits over massive cyberbreach,9/12/2017,1,,
319,Irma: Six dead at Florida nursing home left without power,9/13/2017,1,,
320,"Utah blood nurse arrest 'violated police codes', says report",9/14/2017,1,,
321,U.S. Bans All Federal Agencies From Using Kaspersky Software,9/15/2017,1,,
322,"Study: Flint water killed unborn babies; many moms who drank it couldn't get pregnant - Babies born in Flint after switch to river water also nearly 150 grams lighter than those born in other areas of Michigan, and gained less weight.",9/22/2017,1,,
323,"Georgia: Bounty hunters took the wrong woman into custody at Columbus Walmart. A jury awarded her $950,000.",9/23/2017,2,,
324,NY Governor Cuomo: Stop arguing about football protests and start helping Puerto Rico,9/25/2017,0,,
325,Former neo-Nazi removes swastika tattoos after unlikely friendship,9/26/2017,0,,
326,Head Of Air Force Academy Tells Cadets: 'You Should Be Outraged' By Racial Slurs,9/29/2017,1,,
327,Trump lashes out at San Juan mayor who begged for more help,10/1/2017,2,,
328,"More than 50 people killed, 200 hurt in Las Vegas Strip shooting",10/2/2017,1,,
329,'Active shooter' near Las Vegas casino,10/2/2017,2,,
330,This Couple Scammed Amazon Out of $1.2 Million. Now They Have to Pay It Back,10/3/2017,1,,
331,"Oregon pays out $85 million in pot taxes to school fund, cops, other services",10/7/2017,2,,
332,Company behind 'Fearless Girl' statue hit with $5M fine for underpaid female workers - State Street Corp. settles with U.S. Dept. of Labor for race and gender discrimination,10/8/2017,2,,
333,"Nazi-killing video game ""Wolfenstein II"" angers Nazis with 'Make America Nazi-Free Again' slogans",10/9/2017,0,,
334,VP Pence walks out of Colts game after National Anthem.( Players kneeled),10/9/2017,0,,
335,Arizona: Maricopa County's Tent City jail officially shut down,10/10/2017,1,,
336,"U.S. House panel approves $36.5 billion for hurricane, wildfire relief",10/11/2017,1,,
337,Actor Terry Crews says he was groped by a ‘high level Hollywood executive’,10/11/2017,1,,
338,Donald Trump attacked for authoritarian threat to shut down critical news stations,10/12/2017,0,,
339,Hustler’s Flynt runs ad offering $10 million for ‘smoking gun’ leading to Trump impeachment,10/15/2017,2,,
340,Kansas stole 23 years of Lamonte McIntyre's life. His compensation: $0 - Kansas is one of 18 states that offers zero compensation for individuals who have been wrongly incarcerated and later exonerated.,10/17/2017,1,,
341,Killer of Navajo Nation girl gets life prison sentence,10/21/2017,2,,
342,Thousands of Americans Will Scream Helplessly at the Sky on Trump's Election Anniversary,10/30/2017,0,,
343,The party is over -- Both the Republican and Democratic Parties are in crisis — and may be headed for worse,10/31/2017,1,,
344,"At least 27 people have been killed and 30 people have been injured in a mass shooting at a church in Sutherland Springs, Texas.",11/6/2017,1,,
345,Fox News cancels Donald Trump impeachment adverts,11/7/2017,0,,
346,"The Incarcerated Women Who Fight California’s Wildfires -- By choice, for less than $2 an hour, the female inmate firefighters of California work their bodies to the breaking point. Sometimes they even risk their lives.",11/7/2017,0,,
347,Texas church shooter previously escaped mental health institution while facing military charges,11/8/2017,1,,
348,"Alt-right blogger Jenna Abrams, who has 70,000 followers, does not exist, was created by St. Petersburg troll farm",11/9/2017,0,,
349,Pastor: Texas church that was attacked will be demolished. Pastor Frank Pomeroy told leaders of the Southern Baptist Convention earlier this week that it would be too painful to continue using First Baptist Church as a place of worship.,11/10/2017,0,,
350,Trump thinks Scientology should lose tax-exempt status,11/11/2017,2,,
351,Bill Gates firm buys Arizona land for $80 million to create 'smart city,11/13/2017,1,,
352,Amazon faces fines following the death of a second warehouse worker in as many months,11/14/2017,1,,
353,Joe Biden claims Barack Obama repeatedly discouraged him from running for US president,11/15/2017,0,,
354,"The Boomtown That Shouldn’t Exist -- Cape Coral, Florida, was built on total lies. One big storm could wipe it off the map. Oh, and it’s also the fastest-growing city in the United States.",11/16/2017,1,,
355,Keystone Pipeline closed after major oil spill,11/18/2017,2,,
356,Florida let hepatitis C go untreated in prisons. Now it may cost taxpayers millions.,11/19/2017,2,,
357,"Charles Manson, mastermind of 1969 murders, dies at 83",11/20/2017,1,,
358,"If you want to see what America would be like if it ditched net neutrality, just look at Portugal",11/22/2017,0,,
359,Former FCC chair Tom Wheeler discusses what ending net neutrality means.,11/23/2017,2,,
360,What happens once 'net neutrality' rules bite the dust?,11/24/2017,1,,
361,Veterans are key as surge of states OK medical cannabis for PTSD,11/27/2017,1,,
362,A woman approached The Post with dramatic — and false — tale about Roy Moore. She appears to be part of undercover sting operation.,11/28/2017,1,,
363,U.S. gymnastics team doctor sentenced to 60 years for child pornography,12/9/2017,2,,
364,"At 230,000 acres, Thomas fire is now the fifth-largest wildfire in modern California history",12/11/2017,1,,
365,Alabama: Doug Jones defeats Roy Moore for U.S. Senate seat,12/13/2017,1,,
366,"Accused of molesting teen, Kentucky Rep. Dan Johnson commits suicide",12/14/2017,0,,
367,California state senator pledges to bring back net neutrality rules just as FCC votes to repeal them,12/15/2017,1,,
368,"AT&T is giving $1,000 bonuses to 200,000 employees after tax bill",12/21/2017,1,,
369,"California: Defying Trump again, Gov. Jerry Brown pardons immigrants about to be deported",12/24/2017,2,,
370,Thomas Fire becomes the largest in recorded California history,12/25/2017,2,,
371,Donald Trump said he’d be ‘back to work’ the day after Christmas but instead he played golf,12/27/2017,1,,
372,Louisiana: Police nab 'Nigerian prince.' He's a 67-year-old guy in Slidell. Who knew?,12/30/2017,2,,
373,U.S. officials say they wrongly announced coal mine expansion,1/1/2018,2,,
374,ATT sued over layoffs after promising more investment because of tax cut,1/5/2018,1,,
375,FBI: Man with white supremacist ties stopped train in rural Nebraska with intent to harm passengers,1/6/2018,2,,
376,The DOJ Charged a White Supremacist With Terrorism But Didn't Tell Anyone,1/9/2018,1,,
377,California inhales: The Golden State’s new pot laws are almost comically progressive -- Some cities plan to give people with marijuana convictions priority when setting up legal pot shops,1/11/2018,1,,
378,Idaho: Girl ordered to leave school after being twice raped in computer lab by older boy files lawsuit in federal court,1/13/2018,2,,
379,Obama rips Fox News viewers: ‘You are living on a different planet’,1/13/2018,2,,
380,Colorado administrators indicted for suspending student who reported sex assault by teacher,1/13/2018,2,,
381,"CVS bans photo manipulation in store beauty brands, pressures suppliers",1/16/2018,0,,
382,"""I’m the one that saved coal,” says Trump as miner deaths nearly double in first year of office",1/29/2018,0,,
383,"Hawaii’s false missile alert sent by worker who thought attack on U.S. was imminent, FCC says",1/31/2018,0,,
384,Judge says she will not punish victims' father who lunged at Larry Nasser,2/3/2018,2,,
385,"Dow Jones share index down 1,175 points on closing in biggest ever one-day point drop and biggest fall since 2008 financial crisis",2/6/2018,1,,
386,Donald Trump orders Pentagon to plan grand military parade | US news,2/7/2018,1,,
387,George Bush: 'pretty clear evidence Russia meddled' in US election,2/8/2018,0,,
388,"Flu still on the rise, hospitalizations high, CDC says",2/10/2018,2,,
389,California launches probe into Aetna after former director admits he didn't look at patients' medical records when denying them treatment,2/12/2018,1,,
390,Trump's budget hits poor Americans the hardest; aims to replace food stamps with high-end meal kits,2/13/2018,1,,
391,"EPA chief Scott Pruitt thinks $1,600 is reasonable for a D.C.-New York flight",2/13/2018,1,,
392,"Pepsi announced it's laying off employees the same day it touted $1,000 bonuses because of the new tax law",2/14/2018,1,,
393,"Bill, Melinda Gates turn attention toward poverty in America",2/14/2018,1,,
394,A football coach who shielded students from the Florida shooter died as he lived -- by putting himself second,2/15/2018,1,,
395,EPA Head Says He Needs to Fly First Class Because People Are Mean to Him in Coach,2/15/2018,1,,
396,White House refuses to release photo of Trump signing bill to weaken gun law,2/16/2018,1,,
397,Ajit Pai Is Reportedly Being Investigated by the FCC's Inspector General,2/16/2018,1,,
398,"Hero Citizen Stops Mass Shooting in a Church, Cops Show Up and Shoot HIM—Media Silent",2/19/2018,2,,
399,"West Virginia: Statewide walkout announced for school teachers, employees on Thursday and Friday",2/20/2018,0,,
400,"Fla. shooting survivor and family receive death threats after conspiracy theories circulate that they are ""actors""",2/23/2018,1,,
401,Trump considers pulling ICE out of California to let the state learn,2/24/2018,2,,
402,Why Your Pharmacist Can't Tell You That $20 Prescription Could Cost Only $8 - States are moving to block “gag clauses” that prohibit pharmacists from telling customers that they could save money by paying cash for prescription drugs rather than using their health insurance.,2/25/2018,2,,
403,Broward Deputies Reportedly Told Not To Enter School During Shooting Unless Body Cameras Were On,2/27/2018,0,,
404,"'$5,000 will not even buy a decent chair': HUD staffer files complaint over Ben Carson office redecoration",2/28/2018,0,,
405,"Alex Jones Accused of Sexual Harassment, Bullying at InfoWars - The Daily Beast",3/1/2018,0,,
406,West Virginia Schools Closing Monday as Strike Set to Enter 12th Day,3/5/2018,1,,
407,"Reddit Confirms What Users Were Warning — The Site, Especially The_Donald, Was Haven For Russian Propaganda",3/6/2018,0,,
408,"Shooting at Alabama high school; one student killed, another injured",3/8/2018,1,,
409,There have been 17 officers shot to death in the first 10 weeks of this year,3/11/2018,2,,
410,National Walkout: Nickelodeon off air for 17 minutes recognizing Parkland,3/15/2018,1,,
411,"Under Trump's watch, national debt tops $21 trillion for first time ever",3/17/2018,2,,
412,high school on lockdown after shooting in maryland.,3/20/2018,1,,
413,Trump’s election consultants filmed saying they use bribes and sex workers to entrap politicians,3/20/2018,1,,
414,Federal judge blocks Mississippi 15-week abortion ban from going into effect,3/21/2018,0,,
415,Saudi Crown Prince Boasted That Jared Kushner Was “In His Pocket”,3/22/2018,0,,
416,Patriots loan plane to Parkland students for D.C. trip,3/24/2018,2,,
417,March for Our Lives could be the biggest single-day protest in D.C.'s history,3/25/2018,2,,
418,Father gets 60 years for trying to sell 4-year-old daughter for sex,3/25/2018,2,,
419,Jared Kushner's Younger Brother Had Vowed To #MarchForOurLives. And He Did.,3/26/2018,1,,
420,"No, Parkland Student Emma González Did Not Rip Up the U.S. Constitution",3/27/2018,0,,
421,Texas megachurch pastor charged by federal authorities with defrauding elderly investors,4/1/2018,2,,
422,"'Tired of begging': Teacher rebellion shuts down Oklahoma, Kentucky schools",4/4/2018,1,,
423,Facebook sent a doctor on a secret mission to ask hospitals to share patient data,4/6/2018,0,,
424,Dow tumbles 572 points as trade war fears pummel stocks,4/7/2018,2,,
425,Trump Tower blaze kills man on floor without sprinklers,4/8/2018,2,,
426,Dow's 400-point rally is nearly erased in final hour on report of FBI raid of Trump's lawyer,4/10/2018,1,,
427,"Zuckerberg deflects senators’ Facebook questions, and gets $3 billion for the effort",4/11/2018,0,,
428,FDA now accepting comments to reclassify marijuana,4/11/2018,0,,
429,"4 in 10 millennials don't know 6 million Jews were killed in Holocaust, study shows",4/13/2018,0,,
430,Trump lawyer arranged $1.6 million payoff to Playboy Playmate for Republican fundraiser: source,4/14/2018,2,,
431,TSA finds three loaded guns in one morning at Tampa International Airport,4/17/2018,1,,
432,Ajit Pai’s FCC broadband adviser arrested on fraud charges,4/18/2018,0,,
433,"E.P.A. Chief’s $43,000 Phone Booth Broke the Law, Congressional Auditors Say",4/18/2018,0,,
434,U.S. appeals court says Ohio cannot block Planned Parenthood funds,4/19/2018,0,,
435,"Minnesota: Prince was a high-profile casualty to fentanyl-laced pill scourge - On Thursday, Carver County Attorney Mark Metz said evidence suggested that Prince unknowingly took counterfeit Vicodin painkillers that actually contained fentanyl.",4/20/2018,0,,
436,Wells Fargo will be fined $1 billion,4/20/2018,0,,
437,Indiana abortion law signed by Mike Pence ruled unconstitutional by 7th Circuit,4/21/2018,2,,
438,Waffle House shooter was once arrested by Secret Service for trespassing near White House,4/23/2018,0,,
439,N.J. officers praised after weathering official's profane outburst,4/26/2018,1,,
440,"Report: Suspected East Area Rapist — who murdered 12, raped 45 — held in Sacramento jail",4/26/2018,1,,
441,Bill Cosby 'guilty' of sexual assault,4/27/2018,0,,
442,Federal agents peered into a duffel bag on the Mexico border. They found a tiger cub.,5/2/2018,0,,
443,Native American men removed from university tour after parent tells cops they made her 'nervous',5/3/2018,1,,
444,"Homeless man breaks into California governor's residence, says he's an 'open-door policy kind of guy'",5/3/2018,1,,
445,"Mormon church severing ties with Boy Scouts, ending century-long bond",5/9/2018,1,,
446,"Authorities respond to reports of shots fired at Highland High School in Palmdale, California",5/11/2018,1,,
447,"Hurting from low sales and Trump tariffs, Harley Davidson will close its Kansas City plant",5/11/2018,1,,
448,Firm That Denied Its Cohen Payment Was Connected to Russian Billionaire Turns Out to Be Super-Connected to Russian Billionaire,5/12/2018,2,,
449,67 Environmental Rules on the Way Out Under Trump,5/14/2018,1,,
450,Melania Trump hospitalized after kidney procedure,5/15/2018,0,,
451,Google Employees Resign in Protest Against Pentagon Contract,5/15/2018,0,,
452,"The US has a salmonella outbreak caused by eggs, leading to the largest recall since 2010",5/15/2018,0,,
453,Documents show Ajit Pai met with AT&T execs right after the company started paying Michael Cohen.,5/16/2018,1,,
454,"American Airlines bans insects, hedgehogs and goats as emotional support animals",5/16/2018,1,,
455,"Tom Wolfe, pioneering 'New Journalist,' dead at 88",5/16/2018,1,,
456,"When a 5-year-old returned to school for the first time after his police officer dad's death, 70 cops stood beside him",5/17/2018,0,,
457,"Senate Votes to Save Net Neutrality, Proving Shame Still Works Sometimes",5/17/2018,0,,
458,LIVE COVERAGE: At least 8 killed in Santa Fe High School shooting,5/18/2018,1,,
459,'Eight killed' in Texas school shooting,5/18/2018,1,,
460,"US birth rates hit record low and diaper, baby bottle companies are feeling the pinch",5/18/2018,1,,
461,Man yelling about the President opens fire at Trump golf resort,5/18/2018,1,,
462,"25-year-old posed as Dallas ISD student to relive basketball glory at Hillcrest High, officials say",5/18/2018,1,,
463,Explosive eruption rocks Hawaii's Kilauea volcano: USGS,5/18/2018,1,,
464,Houston Texans defensive end to pay for Texas shooting funerals,5/19/2018,2,,
465,"In April, they walked out to protest school shootings. Today, they were victims of one",5/19/2018,2,,
466,China will 'significantly increase' purchases of US goods and services,5/20/2018,2,,
467,Houston Police Chief Says He’s Sick Of Inaction On Gun Control,5/20/2018,2,,
468,"FYI: English isn't the official language of the United States. A lot of multilingual countries promote an official language, but the United States has never done so with English. In fact, the US has no official language.",5/21/2018,1,,
469,US and China halt imposing import tariffs,5/21/2018,1,,
470,Barack and Michelle Obama to make TV and films for Netflix,5/22/2018,0,,
471,"White House, EPA headed off chemical pollution study -- The intervention by Scott Pruitt’s aides came after one White House official warned the findings would cause a ‘public relations nightmare.'",5/22/2018,0,,
472,"The payers’ revolt: Americans, tired of high-priced drugs, are fighting back -- Whatever Donald Trump says, pharma firms should feel queasy",5/22/2018,0,,
473,Judge rules 30-year-old must move out of his parents' house,5/23/2018,1,,
474,Nearly 100 illegal immigrants found hiding in trailer during traffic stop,5/23/2018,1,,
475,US couple sue son who refuses to move out,5/23/2018,1,,
476,California Becomes First State to Require Solar Panels on New Houses,5/23/2018,1,,
477,"Hawaii volcano lava flows into power plant, sparking fears of deadly gas release",5/23/2018,1,,
478,Sinkhole appears on White House lawn,5/23/2018,1,,
479,Trump says summit with Kim may be delayed,5/23/2018,1,,
480,Trump pulls out of North Korea summit,5/24/2018,0,,
481,Jets CEO Chris Johnson Says He'll Pay The Fines For His Players Who Want To Protest During Anthem,5/24/2018,0,,
482,Judge Rules Trump Can’t Block People on Twitter,5/24/2018,0,,
483,Suspect in custody after shots reported fired at a Indiana middle school,5/25/2018,0,,
484,Elon Musk To Develop Media Bias Rating Website: Media Freaks Out,5/25/2018,0,,
485,"TotalBiscuit, one of gaming's most popular YouTubers, has passed away",5/26/2018,2,,
486,Border Patrol slightly changes account of undocumented woman's fatal shooting,5/26/2018,2,,
487,BREAKING: Armed Citizen Kills Mass Shooter At Oklahoma Restaurant,5/26/2018,2,,
